,id,text,created_at,did_report_as_spam,owner.id,owner.is_verified,owner.profile_pic_url,owner.username,likes,comments
598,18132532396024543,No es veraz esa publicidad porque al final te dicen que vayas a sus oficinas !! @indecopioficial,1584632087,False,482590855,False,https://instagram.fmex16-1.fna.fbcdn.net/v/t51.2885-19/s150x150/69286745_2432033593743703_6875548969317957632_n.jpg?_nc_ht=instagram.fmex16-1.fna.fbcdn.net&_nc_ohc=Z-Vgzz6Z7nwAX8OJF6u&oh=76b75a43940128e9148a2b0838b02a6d&oe=5FB2E500,aarondiego12,0,2
599,18095783311185774,Si a mi ya me están ya cobrando por medio de mensaje de texto no es justo,1584639192,False,2951247835,False,https://instagram.fmex16-1.fna.fbcdn.net/v/t51.2885-19/s150x150/49907223_378142026096449_8175071885424328704_n.jpg?_nc_ht=instagram.fmex16-1.fna.fbcdn.net&_nc_ohc=JdYleoqUeJoAX_roCdc&oh=0a1d312c6ba30e39a1ed36b66da10df3&oe=5FB40C67,frankdelionel,0,0
600,18099963016190585,Sin intereses?,1584640594,False,2223228990,False,https://instagram.fmex16-1.fna.fbcdn.net/v/t51.2885-19/s150x150/36535811_214168742753956_361411022533165056_n.jpg?_nc_ht=instagram.fmex16-1.fna.fbcdn.net&_nc_ohc=NE1PsM7kY58AX_DobSX&oh=393a0abb01a684f939f678fc2e3b0635&oe=5FB3C02F,pili_pv,0,0
601,17886790696497308,La comision para hacer retiros en agentes deberian de exonerarla durante el tiempo de la pandemia,1584645357,False,8891605935,False,https://instagram.fmex16-1.fna.fbcdn.net/v/t51.2885-19/s150x150/43512789_317182209066610_6516229424059252736_n.jpg?_nc_ht=instagram.fmex16-1.fna.fbcdn.net&_nc_ohc=wZK5x8Xip10AX-1YYh9&oh=b3bdac8a1ac8ba6a7ee4f0ee54dd0e1e&oe=5FB2E53E,oscaryrasiul,0,3
602,17860325914788820,"Una excelente iniciativa de parte de un gran banco, gracias por el apoyo, la mayoría de sus clientes lo necesita, un apoyo que merece aplausos !!!",1584645535,False,1416811989,False,https://instagram.fmex16-1.fna.fbcdn.net/v/t51.2885-19/s150x150/29095970_1961001694214477_756440368999825408_n.jpg?_nc_ht=instagram.fmex16-1.fna.fbcdn.net&_nc_ohc=ySRC6kNdtbYAX8HhtgI&oh=763305333a0465d38a3c50a7934cf78f&oe=5FB24FF2,robertsinche,0,0
603,17844682829048816,Como.hago para pedir posgergacion y segundo si van a correr mas intereses. Espero que no sea repactacion de deuda,1584648432,False,3321573242,False,https://instagram.fmex16-1.fna.fbcdn.net/v/t51.2885-19/s150x150/39196304_308373269938596_5423749091538501632_n.jpg?_nc_ht=instagram.fmex16-1.fna.fbcdn.net&_nc_ohc=DO6yV5cWUtUAX_tXSss&oh=d504ed90cc41959877070231a8fb7a50&oe=5FB356B3,thecuacro,0,1
604,17858821588807722,He llamado a su central y les importo un bledo. Encima hacen descuento automático.,1584651157,False,7749513125,False,https://instagram.fmex16-1.fna.fbcdn.net/v/t51.2885-19/s150x150/72656819_685131868562853_8256285151441453056_n.jpg?_nc_ht=instagram.fmex16-1.fna.fbcdn.net&_nc_ohc=Fjt2M4NBgvYAX_AEYFc&oh=4d40985ca59f79ae882d1034cfc043fa&oe=5FB3A45F,alvaro_rodriguez_41,0,0
605,17899869889453561,"Diners e Interbank estando dando la facilidad de que el pago mínimo se fraccione en 6 y 12 cuotas sin intereses . Llame a Bbva_peru y dicen que si van a re programar pero cobrando intereses , no se solidarizan como otros bancos",1584653149,False,1625934395,False,https://instagram.fmex16-1.fna.fbcdn.net/v/t51.2885-19/s150x150/19228126_1361762033860519_1228795963066286080_a.jpg?_nc_ht=instagram.fmex16-1.fna.fbcdn.net&_nc_ohc=8CmdR9XoGrIAX9XlpSm&oh=ae5d9bb9260c3b571f78759ceebb7937&oe=5FB2D541,mabelalavado,0,0
606,17881275514533814,Me acaban de cobrar porque la transferencia interbancaria que hice pra pagar mi tarjeta de crédito se demoro 50 soleS.,1584660520,False,405756882,False,https://instagram.fmex16-1.fna.fbcdn.net/v/t51.2885-19/11373646_1029087760443566_1519051824_a.jpg?_nc_ht=instagram.fmex16-1.fna.fbcdn.net&_nc_ohc=zOQDAk3NiakAX_y4I8Q&oh=6a7ed09550956adb848add703afdb132&oe=5FB5164F,martin.canalesso,0,0
608,17895031270466393,"Buenas tardes, yo tengo un préstamo. Que pago todos los 4 de cada mes, por favor como puedo hacer tengo ir al banco personalmente? Gracias",1584733790,False,7218028216,False,https://instagram.fmex16-1.fna.fbcdn.net/v/t51.2885-19/s150x150/37000897_404782786677979_415557516320047104_n.jpg?_nc_ht=instagram.fmex16-1.fna.fbcdn.net&_nc_ohc=Jks1MK-rVkYAX8RJkvJ&oh=36a1a279b099b3a921f2765cff16fb46&oe=5FB3EEC4,mercedes.zavaleta.1,0,1
609,17848379695984138,Si bien es cierto se va a reprogramar deudas debido a estado de emergencia pero confirmen se van a realizar dichas operaciones sin condonacion de intereses,1584748506,False,5661028768,False,https://instagram.fmex16-1.fna.fbcdn.net/v/t51.2885-19/s150x150/64640512_332513487701934_4542191643691843584_n.jpg?_nc_ht=instagram.fmex16-1.fna.fbcdn.net&_nc_ohc=GQw6qTzMvcYAX92vzrp&oh=a4db4863352f84aa2d77a3b8011d6156&oe=5FB3EAA4,cappalomo,0,0
610,17857617811820919,Como puedo reprogranar la cuota de mi crédito vehicular x BBVA CONSUMER?,1584760472,False,1933504854,False,https://instagram.fmex16-1.fna.fbcdn.net/v/t51.2885-19/s150x150/33650944_421259005009275_8774271556097409024_n.jpg?_nc_ht=instagram.fmex16-1.fna.fbcdn.net&_nc_ohc=v8hITeIZHvEAX-P-FBQ&oh=cee612b80ad10cc3855aa57e392ca724&oe=5FB4D496,giuliana.lunag,0,0
611,17942178922338289,Quiero hacer una reprogramacion @bbva_peru,1584817479,False,1107505151,False,https://instagram.fmex16-1.fna.fbcdn.net/v/t51.2885-19/s150x150/54510801_549763738851482_3714893952214630400_n.jpg?_nc_ht=instagram.fmex16-1.fna.fbcdn.net&_nc_ohc=dGHr2d9vVtUAX87xYu1&oh=a4774d54d492bfe7512da11866fd0e75&oe=5FB2B0EE,df2h,0,1
612,17866600402714207,También tendremos Reprogramacion de pago para las tarjetas de crédito o al menos un pago parcial sin que nos llenen de intereses al igual que con los prestamos?????,1584935304,False,647482804,False,https://instagram.fmex16-1.fna.fbcdn.net/v/t51.2885-19/s150x150/95216826_523115101666088_8005962938328285184_n.jpg?_nc_ht=instagram.fmex16-1.fna.fbcdn.net&_nc_ohc=gwqdH5FBZfAAX_1sLl6&oh=bea8f3068aa57ede3361423c1946739b&oe=5FB280E9,lorem37,0,0
613,17906579971428840,"Buenas tardes, el miércoles  llame para ver cuáles son las facilidades para reprogramar el pago de mi tarjeta y me dijeron que por banca telefónica no pueden que no califico, que no soy cliente de riesgo. Que caraj.... significa? Les escribo DM no me responden. Voy a la agencia y me dicen q tengo que ir hasta la agencia donde me otorgaron la TDC ósea que con inamovilidad tengo que trasladarme desde el cono norte hasta el sur. Me dieron el correo de uña gerente una tal Jessica Rodriguez, la cual no tiene ni la gentileza de responder. Es así como dan facilidades? Otros bancos ya re programaron mis pagos y vía telefónica a quien más le tengo que escribir al presidente del BBVA , al libro de reclamaciones no entiendo",1584969267,False,243488341,False,https://instagram.fmex16-1.fna.fbcdn.net/v/t51.2885-19/s150x150/89472614_701385950600203_7035461974821437440_n.jpg?_nc_ht=instagram.fmex16-1.fna.fbcdn.net&_nc_ohc=meiKR1IrP68AX-wp2zL&oh=38408f66888eb2c27e84a8e04c959fc2&oe=5FB5C412,sdelart,0,0
614,18091769539153893,"Buenos días, he llamado varias veces al número (01) 595 0000 para solicitar la reprogramación de pagos, pero suena ocupado. Estoy intentando ahora y sucede lo mismo. ¿Hay otro canal de comunicación disponible para hacer esta solicitud?",1584979190,False,533942535,False,https://instagram.fmex16-1.fna.fbcdn.net/v/t51.2885-19/s150x150/91856982_219583639296327_4109214109386407936_n.jpg?_nc_ht=instagram.fmex16-1.fna.fbcdn.net&_nc_ohc=W532xngx1s4AX_lGCjb&oh=73c9d055e7aa724edeea6e05f52666a7&oe=5FB59351,afcallegari,0,0
615,17855605750870589,"Llamé pero no saben si hay o no intereses, me dicen que me acerce a una agencia",1585009162,False,145881194,False,https://instagram.fmex16-1.fna.fbcdn.net/v/t51.2885-19/s150x150/28427283_171561800313512_9169982135916822528_n.jpg?_nc_ht=instagram.fmex16-1.fna.fbcdn.net&_nc_ohc=SozRX0fpW1EAX8tVtoP&oh=df294715116a0c9b5f4655431e76ee72&oe=5FB5D82A,fabita04,0,0
616,17942585050341358,"Señores llamo y me dicen q por esa vía no pueden ayudarme q tengo q ir a la oficina donde obtuve mi crédito, es absurdo. Escribí por acá escribí al DM le escribí a una tal gerente Jessica de la agencia de comandante espinar, y no tengo respuesta alguna de uds",1585063575,False,243488341,False,https://instagram.fmex16-1.fna.fbcdn.net/v/t51.2885-19/s150x150/89472614_701385950600203_7035461974821437440_n.jpg?_nc_ht=instagram.fmex16-1.fna.fbcdn.net&_nc_ohc=meiKR1IrP68AX-wp2zL&oh=38408f66888eb2c27e84a8e04c959fc2&oe=5FB5C412,sdelart,0,0
617,17850959884947591,"Y volvieron a borrar mi publicación , ok esto ira al libro de reclamaciones y lo publicare en donde pueda , si lo borraron es porq no asumen su compromiso",1585064984,False,243488341,False,https://instagram.fmex16-1.fna.fbcdn.net/v/t51.2885-19/s150x150/89472614_701385950600203_7035461974821437440_n.jpg?_nc_ht=instagram.fmex16-1.fna.fbcdn.net&_nc_ohc=meiKR1IrP68AX-wp2zL&oh=38408f66888eb2c27e84a8e04c959fc2&oe=5FB5C412,sdelart,0,0
618,17861100787778856,Van a borrar todas mis publicaciones ladrones,1585065147,False,243488341,False,https://instagram.fmex16-1.fna.fbcdn.net/v/t51.2885-19/s150x150/89472614_701385950600203_7035461974821437440_n.jpg?_nc_ht=instagram.fmex16-1.fna.fbcdn.net&_nc_ohc=meiKR1IrP68AX-wp2zL&oh=38408f66888eb2c27e84a8e04c959fc2&oe=5FB5C412,sdelart,0,0
619,18110154490109097,Porque no facilitan un correo electrónico como otros bancos !!! Por favor .,1585070275,False,1382797624,False,https://instagram.fmex16-1.fna.fbcdn.net/v/t51.2885-19/s150x150/84738663_181349179841065_2874078946389917696_n.jpg?_nc_ht=instagram.fmex16-1.fna.fbcdn.net&_nc_ohc=TampwA5QU5YAX9tx9ve&oh=c316edd7f78c5c1774e3ecfd16175bc7&oe=5FB2F0A3,ai.to.37,0,0
620,17965969291307024,En mi caso me toca pagar mi tarjeta de crédito el 5 de abril hay posibilidades de poder reprogramar esa fecha y pagar la próxima fecha o en mayo obviamente no será con los dos messes acumulados,1585340329,False,3235097842,False,https://instagram.fmex16-1.fna.fbcdn.net/v/t51.2885-19/s150x150/104350044_871041960072724_8817088309017818345_n.jpg?_nc_ht=instagram.fmex16-1.fna.fbcdn.net&_nc_ohc=Zklt9ZwCgWgAX9SMGDU&oh=843c56927c92c8d55276072eb8d369ba&oe=5FB5019E,fidelcovarrubias1968,0,0
621,17847360115998501,"@bbva_peru retire con mi tarjeta bcp 2 veces 400 soles del cajero bbva, y me cobraron 15 soles por cada retiro porfavor! Se supone que era libre de comisiones. Yo soy cliente tambien del bbva..! Como hago?",1585341897,False,22369940,False,https://instagram.fmex16-1.fna.fbcdn.net/v/t51.2885-19/s150x150/15538522_1242216892498774_5780834970335444992_a.jpg?_nc_ht=instagram.fmex16-1.fna.fbcdn.net&_nc_ohc=yJ8UySbE3foAX8nsn3q&oh=0a9be54fce936b3c7aec906267ede04b&oe=5FB3D5A6,blishet,0,0
622,17847813464008617,"Estoy tratando de comunicarme con uds hace días, y no puedo se venció mi cuota ayer y Hasta ahora no puedo repregramar Nada",1585700261,False,1130467402,False,https://instagram.fmex16-1.fna.fbcdn.net/v/t51.2885-19/s150x150/87897885_222422868946323_8760955516802301952_n.jpg?_nc_ht=instagram.fmex16-1.fna.fbcdn.net&_nc_ohc=N2nNHClnghAAX9hqmMb&oh=939dac8ba733aed5d7e411057ca0f4be&oe=5FB32451,karlossalas,0,0
623,17861243800911183,@vanesaavedrag,1592447629,False,1466102599,False,https://instagram.fmex16-1.fna.fbcdn.net/v/t51.2885-19/s150x150/11875359_655917861211027_2010664210_a.jpg?_nc_ht=instagram.fmex16-1.fna.fbcdn.net&_nc_ohc=E0fkwjrDpycAX8nVHYv&oh=28232debf14a1bbf636ab1f43ec0eec0&oe=5FB42C0C,hernan_moya69,0,0
624,18033769435270093,@daniel.castillo.37051579,1592447660,False,1466102599,False,https://instagram.fmex16-1.fna.fbcdn.net/v/t51.2885-19/s150x150/11875359_655917861211027_2010664210_a.jpg?_nc_ht=instagram.fmex16-1.fna.fbcdn.net&_nc_ohc=E0fkwjrDpycAX8nVHYv&oh=28232debf14a1bbf636ab1f43ec0eec0&oe=5FB42C0C,hernan_moya69,0,0
626,17958242221328048,Estafadores respondan los reclamos!!!! 🤬🤬🤬🤬🤬,1594214779,False,1976876273,False,https://instagram.fmex16-1.fna.fbcdn.net/v/t51.2885-19/s150x150/93197095_225642858495940_7022835973562040320_n.jpg?_nc_ht=instagram.fmex16-1.fna.fbcdn.net&_nc_ohc=4p0vJLIvNT0AX9lrDmT&oh=e7d3417984e17f5e6b9adbfaba8e35f6&oe=5FB4395E,ale_del_risco,0,0
628,17877731281585997,Puedo rescatar mi fondos mutuos online? Sus oficinas están repletas.,1585613383,False,31296029,False,https://instagram.fmex16-1.fna.fbcdn.net/v/t51.2885-19/s150x150/79753918_519086825624577_5192707390344003584_n.jpg?_nc_ht=instagram.fmex16-1.fna.fbcdn.net&_nc_ohc=9Q68TWQYjgUAX8oTz7Q&oh=a3fff3c7cad2eb403004259ca704ded1&oe=5FB60405,jcastillovera,0,4
629,18136218208021219,BBVA ADELANTE,1585617611,False,2078807838,False,https://instagram.fmex16-1.fna.fbcdn.net/v/t51.2885-19/s150x150/121273449_402686007794508_8985916994600173878_n.jpg?_nc_ht=instagram.fmex16-1.fna.fbcdn.net&_nc_ohc=8ajF2P3_aBcAX_oVeWB&oh=b4ff32972b0c4244608a6ed4ff67bdae&oe=5FB4417B,charo.anayab,0,0
630,17882971561535296,Su banca telefónica siempre  dice ocupado toda una semana en todo los horarios del día  intentando comunicarme y no hay respuesta,1585623440,False,339883665,False,https://instagram.fmex16-1.fna.fbcdn.net/v/t51.2885-19/s150x150/33025566_2117005951862722_7504705753412796416_n.jpg?_nc_ht=instagram.fmex16-1.fna.fbcdn.net&_nc_ohc=Lw-WAeZLTdkAX9z1YTL&oh=1405cf2fb7a483a68671a3ea64af0fd8&oe=5FB5A9DE,melissagisellapc,0,0
631,18057618874212789,Llevo más  de una semana intentando  comunicarme por banca teléfonica  y no responden,1585629798,False,8453560414,False,https://instagram.fmex16-1.fna.fbcdn.net/v/t51.2885-19/s150x150/38957884_250471158910040_1443306854829522944_n.jpg?_nc_ht=instagram.fmex16-1.fna.fbcdn.net&_nc_ohc=Uux4hTlsn38AX-ATjRd&oh=bcb1bc0ca34d5a317c2e03a278f840a7&oe=5FB61574,katty.cordova.357,0,0
632,18110625157108936,A qué número de teléfono debo llamar para que me atiendan? Vengo llamando todo el día al 5950000 y no contestan.,1585630216,False,256940368,False,https://instagram.fmex16-1.fna.fbcdn.net/v/t51.2885-19/s150x150/106603204_574569893446784_1307455058291759153_n.jpg?_nc_ht=instagram.fmex16-1.fna.fbcdn.net&_nc_ohc=gfVaqDsQZPMAX933ssD&oh=b5eb50efe669c2deb02c3eefec49cdb0&oe=5FB54FA1,raularteagab,0,0
633,17871046507639765,Solo atienden por correo y presencial,1585630584,False,2015051751,False,https://instagram.fmex16-1.fna.fbcdn.net/v/t51.2885-19/s150x150/84761846_2803228533047717_809337791807750144_n.jpg?_nc_ht=instagram.fmex16-1.fna.fbcdn.net&_nc_ohc=9g9SwmJg1CgAX-kqkHz&oh=5544ba0a15d99cd97976aaa569629851&oe=5FB38673,bryan.verapuente,0,0
634,17902115647449242,🔥,1585663293,False,13527092325,False,https://instagram.fmex16-1.fna.fbcdn.net/v/t51.2885-19/s150x150/58751313_466158700813520_258843050271309824_n.jpg?_nc_ht=instagram.fmex16-1.fna.fbcdn.net&_nc_ohc=jYBk6jMkRWQAX8Nus6Z&oh=e260dc1b93ad7cf5a4d836b56e40bdf1&oe=5FB4312F,cffc009,0,0
635,17887397692513285,5050000 vengo llamando variis dias no me contestan  para que me puedan aplazar los pagos de mi tarjets como hago ayuda,1585716071,False,4451679398,False,https://instagram.falg3-1.fna.fbcdn.net/v/t51.2885-19/44884218_345707102882519_2446069589734326272_n.jpg?_nc_ad=z-m&_nc_ht=instagram.falg3-1.fna.fbcdn.net&_nc_ohc=MVEG8QTyVK4AX8LGrQC&oh=3c976aaca8ad3da5fb6405ceadde5006&oe=5FB5D50F&ig_cache_key=YW5vbnltb3VzX3Byb2ZpbGVfcGlj.2,josetello6682,0,0
636,17856170812888634,Señores BBVA .. Quiero hacer una transferencia interbancaria desde mi App y me sale no disponible ...,1585850782,False,31827946458,False,https://instagram.fmex16-1.fna.fbcdn.net/v/t51.2885-19/s150x150/118858714_5181682628523912_4951109434259234753_n.jpg?_nc_ht=instagram.fmex16-1.fna.fbcdn.net&_nc_ohc=MPKR0pfwWnsAX_3Zqx8&oh=a7cbdff914b3c9f2b5d7984f33df8bea&oe=5FB4D079,yamahabass2019,0,0
637,17865012766748437,Cual es su nuevo horario?,1586978970,False,1590553081,False,https://instagram.fmex16-1.fna.fbcdn.net/v/t51.2885-19/s150x150/54426135_2044756238966913_9104525618850037760_n.jpg?_nc_ht=instagram.fmex16-1.fna.fbcdn.net&_nc_ohc=ddirenFxGpkAX-sAaXp&oh=a4f6840750013041e7d8daac062a9106&oe=5FB344BC,mlcueto90,0,0
638,18085123372172518,"@micke0307, @pzapataa ☺️",1587491197,False,4324316999,False,https://instagram.fmex16-1.fna.fbcdn.net/v/t51.2885-19/s150x150/120986221_335210180872024_468452075279321365_n.jpg?_nc_ht=instagram.fmex16-1.fna.fbcdn.net&_nc_ohc=BGZxIli1DFEAX8bgpJA&oh=330701f7016d2696bdc69a142cba237d&oe=5FB446A7,caza_0907,2,0
639,17886548119550209,Buen día. Necesito con urgencia entrar desde el extranjero a mi cuenta pero no consigo porque extravíe la tarjeta y no cuento con clave de internet. Cómo proceder en esos casos?,1588135259,False,1084403854,False,https://instagram.fmex16-1.fna.fbcdn.net/v/t51.2885-19/s150x150/118801338_363176031368340_6637215963152732926_n.jpg?_nc_ht=instagram.fmex16-1.fna.fbcdn.net&_nc_ohc=FJrEmisc-sUAX8XYwBj&oh=5bc63152c024c79d6631c5514f53678b&oe=5FB49626,kndy.tg,0,0
640,18127330327075132,Donde averiguo qué agencias están atendiendo??,1588777040,False,9221168986,False,https://instagram.fmex16-1.fna.fbcdn.net/v/t51.2885-19/s150x150/82457871_611508929702094_6698466905063161856_n.jpg?_nc_ht=instagram.fmex16-1.fna.fbcdn.net&_nc_ohc=6MKyM7igeRoAX-72Oei&oh=8572b11b9ac4d4de593f36b17b4f1843&oe=5FB2795A,diazorbezo,1,0
641,17845022258038471,@franiore,1584799395,False,1600047457,False,https://instagram.fmex16-1.fna.fbcdn.net/v/t51.2885-19/s150x150/83898395_332431134365968_3493697329674846208_n.jpg?_nc_ht=instagram.fmex16-1.fna.fbcdn.net&_nc_ohc=RDB5rLtgT_wAX8xLpqo&oh=70e4374b9c78d2fc1c72d640807601a8&oe=5FB48C52,solanshpr,1,0
642,18096889681087791,Cual es la medida que tomaran respecto al pago de los créditos??,1584801721,False,207514062,False,https://instagram.fmex16-1.fna.fbcdn.net/v/t51.2885-19/s150x150/120781284_212867820250880_311441998080588967_n.jpg?_nc_ht=instagram.fmex16-1.fna.fbcdn.net&_nc_ohc=l5YkDaw9G5sAX9wpaSc&oh=7e83e27e66fd6c7834e9b679f2dae54c&oe=5FB4B592,almendra.mapg,1,4
643,17888764531499376,Y como se podrá reducir capital para deudas en cuotas?,1584815170,False,4344347816,False,https://instagram.fmex16-1.fna.fbcdn.net/v/t51.2885-19/s150x150/78745162_596724354233133_653569305190858752_n.jpg?_nc_ht=instagram.fmex16-1.fna.fbcdn.net&_nc_ohc=ONGOzdel22AAX806w-T&oh=5770913538356cf182b4d794117f40ff&oe=5FB3DBF6,carladcbello,0,0
644,17857629664815755,"bbva_peru hoy intenté hacer una transferencia por cajero y luego por app, ninguno de estos medios me permitió realizar la operación, alguna explicación ?",1584827605,False,4377036722,False,https://instagram.fmex16-1.fna.fbcdn.net/v/t51.2885-19/s150x150/27894267_1590444204372868_1960131303328186368_n.jpg?_nc_ht=instagram.fmex16-1.fna.fbcdn.net&_nc_ohc=7jqaKn3ZwaMAX8xJJvE&oh=bb647582623d080f6828a81881599a82&oe=5FB609E0,zavalbef,0,0
645,17939604658346442,Hola en el caso de tarjetas de credito tambien se ñuede cambiar la fecha de pago?,1584929586,False,7634847507,False,https://instagram.fmex16-1.fna.fbcdn.net/v/t51.2885-19/s150x150/31262328_1152907558182038_5375432131092676608_n.jpg?_nc_ht=instagram.fmex16-1.fna.fbcdn.net&_nc_ohc=VpCuZkC__osAX8iqnOl&oh=c8a156a9f3277e9eb6cffa0586648e20&oe=5FB4FF8B,vannesadiandrarouillon,0,0
646,18139777543035733,Porque este mes se cobraron S/100  de penalidad por pago tardio me demire solo 2 dias en pagar 😢,1584929692,False,7634847507,False,https://instagram.fmex16-1.fna.fbcdn.net/v/t51.2885-19/s150x150/31262328_1152907558182038_5375432131092676608_n.jpg?_nc_ht=instagram.fmex16-1.fna.fbcdn.net&_nc_ohc=VpCuZkC__osAX8iqnOl&oh=c8a156a9f3277e9eb6cffa0586648e20&oe=5FB4FF8B,vannesadiandrarouillon,0,0
647,18135778897044736,En la Banca telefónica está desactualizado hay institución que trabajan con el banco y no aparece hay que ponerse las pilas amigos de BBVA,1585054459,False,28224612109,False,https://instagram.fmex16-1.fna.fbcdn.net/v/t51.2885-19/s150x150/81992197_773791913141704_4666433781865906176_n.jpg?_nc_ht=instagram.fmex16-1.fna.fbcdn.net&_nc_ohc=e1ox2JIYQEoAX_ALCdh&oh=888272db8e7909d2a1c066ce870caefd&oe=5FB58947,parqui_5,0,0
648,17852764222951990,"Señores del BBVA dada esta cuyuntura q nos hemos visto imposibilitados de salir a realizar los pagos fuera, tengo mi cuenta sueldo con ustedes y debo realizar mis pagos de tarjeta de otros bancos como Saga y cada pago que realizó cobran 3.50 y si esto lo multiplicamos por muchos usuarios que están en lo mismo cuanto dinero se llevan al bolsillo 😠 es increíble como ayudan!!!",1586716858,False,7275957233,False,https://instagram.fmex16-1.fna.fbcdn.net/v/t51.2885-19/s150x150/67527771_2398744003700205_6850738360588173312_n.jpg?_nc_ht=instagram.fmex16-1.fna.fbcdn.net&_nc_ohc=J63xZ2rS4aMAX-_KvVR&oh=5bc82b9b9622ad5761fba675b6ca86df&oe=5FB3543E,saritaluzo,0,0
649,17889251515698416,😅😅😅😅,1602277463,False,2873237675,False,https://instagram.fmex16-1.fna.fbcdn.net/v/t51.2885-19/s150x150/69564353_347465552803104_5985258036187365376_n.jpg?_nc_ht=instagram.fmex16-1.fna.fbcdn.net&_nc_ohc=eqKLUfu52fIAX83US51&oh=ee3e9af75b9bb031ee4af25ef775b725&oe=5FB3901D,joestrive17,1,0
650,17964683023335469,"Yo Creo lo contrario, porque fui afectado con un tramite que hice en el BBVA para prorroga de cuota hipotecaria y no me avisaron hasta casi 3 meses despues que no procedia el tramite generando mora y deuda sin pagar de 3 meses de Hipoteca como asi puede  tener tal galardon , si yo como usuario fui perjudicado economicamente.",1602277484,False,6067761947,False,https://instagram.fmex16-1.fna.fbcdn.net/v/t51.2885-19/s150x150/21827191_132745497463129_2836744440658264064_n.jpg?_nc_ht=instagram.fmex16-1.fna.fbcdn.net&_nc_ohc=hXYVrw65ZRAAX9CE7o1&oh=dd908ae28a127eca0a9c80d858e3ccec&oe=5FB56C43,calmetj,1,2
651,18012649153293632,Pura mentira,1602278110,False,633215512,False,https://instagram.fmex16-1.fna.fbcdn.net/v/t51.2885-19/s150x150/59787989_2238843076209265_7251653865244721152_n.jpg?_nc_ht=instagram.fmex16-1.fna.fbcdn.net&_nc_ohc=Vx4UnV_35zsAX9YoCp1&oh=7dae8fc2369e322efb9aff73bd1ba8e0&oe=5FB5054C,cesarcanova567,0,0
652,17898243910582099,El peor banco dirás,1602278112,False,40599405539,False,https://instagram.fmex16-1.fna.fbcdn.net/v/t51.2885-19/s150x150/117894878_597065500956836_3687162133214136567_n.jpg?_nc_ht=instagram.fmex16-1.fna.fbcdn.net&_nc_ohc=ct3vSgAeEF0AX-EKJEn&oh=47e40968bee08d3ca2f901873badec7f&oe=5FB50251,mayron._.enriquez,0,0
653,18117654856158536,El banco que no apoya a los cliente ajajja tengo 3 años como cliente recibo sueldo y todo yenes imposible de darme una oferta o tarjeta de crédito mientras que otros banco que no manejo nada d Plata me hicieron ofertas,1602278644,False,447690728,False,https://instagram.fmex16-1.fna.fbcdn.net/v/t51.2885-19/s150x150/53736479_319603188702705_520301834410131456_n.jpg?_nc_ht=instagram.fmex16-1.fna.fbcdn.net&_nc_ohc=4ADR4NB2WHsAX-J6RYZ&oh=2cd69e20e9dbcf1179d534f17677b140&oe=5FB3F1F9,mejiassixto,0,0
654,17853713120273673,"Es verdad, el app siempre está en constantes actualizaciones ❤️",1602278802,False,2802195372,False,https://instagram.fmex16-1.fna.fbcdn.net/v/t51.2885-19/s150x150/93111400_548010256086623_1280120508720873472_n.jpg?_nc_ht=instagram.fmex16-1.fna.fbcdn.net&_nc_ohc=rRpWoBURaQQAX-vQuOV&oh=29840433dd00ad0c1693bbea61e5d992&oe=5FB36ADE,enio.antonio,0,0
655,17909333590518632,🥶🥶🥶🥶,1602278909,False,281631742,False,https://instagram.fmex16-1.fna.fbcdn.net/v/t51.2885-19/s150x150/71517352_440696029898364_8324832850960449536_n.jpg?_nc_ht=instagram.fmex16-1.fna.fbcdn.net&_nc_ohc=VuwYUleQz7wAX9G6xcc&oh=2bb4602b96b24b7664a5c6dfd8b9899d&oe=5FB3B99D,elmer1303,0,0
656,17910740110504237,El mejor?? Sigo esperando que me den solución a un tema con mi tarjeta,1602280790,False,5959142307,False,https://instagram.fmex16-1.fna.fbcdn.net/v/t51.2885-19/s150x150/119422329_907823626414014_8031699417405929008_n.jpg?_nc_ht=instagram.fmex16-1.fna.fbcdn.net&_nc_ohc=9kcl5MtBP8oAX_B4dqD&oh=fc58cdeb147476a3f2db1bf4dfa29b93&oe=5FB5F217,jonathangonzales5762,0,0
657,18039077038276315,"Terrible atención y cero apoyo a sus clientes. Hace poco tuve un caso de robo de tarjeta he hicieron retiros que no reconozco, encima pago un seguro y tampoco lo quieren cubrir. Para que ofrecen productos que a la hora que los necesitas no sirven? Encima me acerco a las oficinas a buscar solución y se lavan las manos diciendo que tengamos cuidado que ellos le dan todos nuestros datos a los couriers y son ellos los que se quedan con la información de la tarjeta y datos personas. Todo mal con este banco.",1602282577,False,1571760648,False,https://instagram.fmex16-1.fna.fbcdn.net/v/t51.2885-19/s150x150/18381008_1878207495801360_9198942207040552960_a.jpg?_nc_ht=instagram.fmex16-1.fna.fbcdn.net&_nc_ohc=JX875VAQtu8AX9n-Gux&oh=e9ec11c731a478228f9dfca853c60839&oe=5FB3F0A2,mafer.caballero,1,2
658,17895779269620449,Sigo esperando respuesta a mi reclamo... Ya va mas de un mes... Mejor banco? 🤦🏻‍♀️,1602283093,False,1205136738,False,https://instagram.fmex16-1.fna.fbcdn.net/v/t51.2885-19/s150x150/37843451_913103432209875_1216170511562702848_n.jpg?_nc_ht=instagram.fmex16-1.fna.fbcdn.net&_nc_ohc=QYVAwO27q3IAX96J6wZ&oh=be390517d58916b43340a5e7af09c50e&oe=5FB26A9B,olgachavezh,0,0
659,17893341346651897,"Pero de q se quejan ellos solos se felicitan, será por haberce aprovechado este año  por abuso de intereses y ganaron un monton",1602283231,False,6752527261,False,https://instagram.fmex16-1.fna.fbcdn.net/v/t51.2885-19/s150x150/25014520_1407248499397759_1385203132794929152_n.jpg?_nc_ht=instagram.fmex16-1.fna.fbcdn.net&_nc_ohc=7A9KcVwJBnoAX_WWuvK&oh=7da0fb28b60aac64692c5a403549e9f6&oe=5FB29C72,ricarditowiner,0,0
660,18152169127074733,Zzz,1602284038,False,15172218273,False,https://instagram.fmex16-1.fna.fbcdn.net/v/t51.2885-19/s150x150/82788961_770582183463910_9183106593900724224_n.jpg?_nc_ht=instagram.fmex16-1.fna.fbcdn.net&_nc_ohc=4umhouTOvxUAX_J7Zhz&oh=49a36b477bb50135efd75fb69670f5e4&oe=5FB5A376,ezequielchb35,0,0
661,17895567316626867,B lo,1602284055,False,15172218273,False,https://instagram.fmex16-1.fna.fbcdn.net/v/t51.2885-19/s150x150/82788961_770582183463910_9183106593900724224_n.jpg?_nc_ht=instagram.fmex16-1.fna.fbcdn.net&_nc_ohc=4umhouTOvxUAX_J7Zhz&oh=49a36b477bb50135efd75fb69670f5e4&oe=5FB5A376,ezequielchb35,0,0
