"id","text","created_at","did_report_as_spam","owner.id","owner.is_verified","owner.profile_pic_url","owner.username","likes","comments"
"17904421312547786","Estoy tratando de comunicarme con un asesor  y no he podido será que pueden ser tan amables de responder?¨gracias.",1601569242,false,"609318321",false,"https://instagram.fmex16-1.fna.fbcdn.net/v/t51.2885-19/s150x150/61549277_341103153231659_2876324960882655232_n.jpg?_nc_ht=instagram.fmex16-1.fna.fbcdn.net&_nc_ohc=U-2ECyIzp6wAX_3yU0D&oh=e5ba0c34999a4d65c9004e81ef64d5a1&oe=5FB4540E","jihnnapao",0,3
"17906819545516335","Que horror de banco! Lo peor de la vida! Pobre de mis padres tener que lidiar con un banco como ustedes ... Se pensionan y el martirio continua. Es un complique comunicarse con algún asesor, todos están ocupados, el asistente virtual no tiene información precisa y personalizada.",1601588660,false,"1529239008",false,"https://instagram.fmex16-1.fna.fbcdn.net/v/t51.2885-19/s150x150/110043563_728593484596361_7581382755666825825_n.jpg?_nc_ht=instagram.fmex16-1.fna.fbcdn.net&_nc_ohc=AOqLu0SLtXcAX9ui2iS&oh=f296345d99f30877c9d266c2940217f9&oe=5FB2762A","nanyospinap",0,1
"17877303493858043","Todas las veces que intento contactarme con BBVA es un desgaste. No solo no contestan sino el contestador automático es insoportablemente estúpido. Cuando será que la @superfinanciera regule este tipo de conductas? Más competencia en el sector bancario necesitamos, así salen del juego los inefectivos como BBVA.",1601590114,false,"1204596518",false,"https://instagram.fmex16-1.fna.fbcdn.net/v/t51.2885-19/s150x150/121216738_197133255182242_4961016764865497815_n.jpg?_nc_ht=instagram.fmex16-1.fna.fbcdn.net&_nc_ohc=a0fQmljuTMkAX_DCQFT&oh=849c2ba83cfdf7f4ccc7a649391fd228&oe=5FB489C2","pedroasanabriap",0,1
"17943337441380258","INCREIBLEMENTE VOY A PAGAR LA ULTIMA CUOTA DE MI CREDITO Y NO LO PUEDO HACER EN LINEA NO PIENSO POR NADA DEL MUNDO PONER UN PIE EN SUS INSTALACIONES POR MI SEGURIDAD Y NO PUEDO HACER EL PAGO???????? Y NO HAY LINEAS DE ATENCION DONDE COMUNICARSE, EL CHAT ES UNA MAQUINA QUE TE DA MULTIPLES RESPUESTAS SISTEMATIZADAS, NADA QUE TENGA QUE VER CON MI SOLICITUD Y EN LAS REDES SOCIALES NOS BLOQUEAN QUE CLASE DE SERVICIO AL CLIENTE ES ESA???? SI NO PUEDO HACER MI PAGO EN LINEA, NO VOY A PAGAR NADA!!! #NoUsoMasBBVA @superfinanciera",1601643889,false,"328683052",false,"https://instagram.fmex16-1.fna.fbcdn.net/v/t51.2885-19/s150x150/101483971_677522626142541_8573400917825552384_n.jpg?_nc_ht=instagram.fmex16-1.fna.fbcdn.net&_nc_ohc=TndpH_2wJZYAX_zzrHI&oh=01ccb5bca0717bf7f6a1479035f25f72&oe=5FB2A702","johis8888",0,1
"17860331576127724","INCREIBLEMENTE VOY A PAGAR LA ULTIMA CUOTA DE MI CREDITO Y NO LO PUEDO HACER EN LINEA NO PIENSO POR NADA DEL MUNDO PONER UN PIE EN SUS INSTALACIONES POR MI SEGURIDAD Y NO PUEDO HACER EL ESTUPIDO PAGO???????? Y NO HAY LINEAS DE ATENCION DONDE COMUNICARSE, EL CHAT ES UNA MAQUINA QUE TE DA MULTIPLES RESPUESTAS SISTEMATIZADAS, NADA QUE TENGA QUE VER CON MI SOLICITUD Y EN LAS REDES SOCIALES NOS BLOQUEAN QUE CLASE DE SERVICIO AL CLIENTE ES ESA???? SI NO PUEDO HACER MI PAGO EN LINEA, NO VOY A PAGAR NADA!!! #NoUsoMasBBVA @superfinanciera",1601643906,false,"328683052",false,"https://instagram.fmex16-1.fna.fbcdn.net/v/t51.2885-19/s150x150/101483971_677522626142541_8573400917825552384_n.jpg?_nc_ht=instagram.fmex16-1.fna.fbcdn.net&_nc_ohc=TndpH_2wJZYAX_zzrHI&oh=01ccb5bca0717bf7f6a1479035f25f72&oe=5FB2A702","johis8888",0,1
"17883793780775504","Hola, buenos días, necesito ayuda con la App de BBVA Móvil, no me permite entrar y necesito cambiar mi clave de Tarjeta Debido, podrían ser tan amables de ayudarme por favor.",1601654034,false,"3165487216",false,"https://instagram.fmex16-1.fna.fbcdn.net/v/t51.2885-19/s150x150/18382596_130719800810745_1741724652889178112_a.jpg?_nc_ht=instagram.fmex16-1.fna.fbcdn.net&_nc_ohc=1ZXJZhL4jb0AX_3H3ix&oh=b9a55470f91615792b68c373adf89432&oe=5FB51869","elizabethhernandez6557",0,1
"17855089031260997","Es real ? Llevo 3 meses cancelando una cuenta y no he Podido ...eso si .. para cobrar las cuotas si de una !",1601669490,false,"311930536",false,"https://instagram.fmex16-1.fna.fbcdn.net/v/t51.2885-19/s150x150/118126837_947254212448514_8084673053672406160_n.jpg?_nc_ht=instagram.fmex16-1.fna.fbcdn.net&_nc_ohc=6opKbA4B6HEAX-22heB&oh=8bf55f85ada6e12af93d4a5138bef639&oe=5FB528B6","anguty",0,1
"17862350774125790","En el teléfono no hay asesores disponibles nunca, en chat de bbva.com.co lo responde un Bot que no entiende nada. Y en estas redes sociales no responden en el chat directo como prometen!  Toco volver al banco físicamente... UGA UGA! Hahaha...",1601678435,false,"282405906",false,"https://instagram.fmex16-1.fna.fbcdn.net/v/t51.2885-19/s150x150/87474001_3277911005556649_7152119948075073536_n.jpg?_nc_ht=instagram.fmex16-1.fna.fbcdn.net&_nc_ohc=FHnnv1ZQxOIAX9-_pUK&oh=3874f6e58a9156221e3dc229002017cd&oe=5FB5D0B3","lfcaba",0,1
"18103901248172088","Y el servicio para cuando ?",1601679662,false,"311930536",false,"https://instagram.fmex16-1.fna.fbcdn.net/v/t51.2885-19/s150x150/118126837_947254212448514_8084673053672406160_n.jpg?_nc_ht=instagram.fmex16-1.fna.fbcdn.net&_nc_ohc=6opKbA4B6HEAX-22heB&oh=8bf55f85ada6e12af93d4a5138bef639&oe=5FB528B6","anguty",0,1
"17899509571580043","BBVA  KMYF20.",1601709163,false,"36968867506",false,"https://instagram.fmex16-1.fna.fbcdn.net/v/t51.2885-19/s150x150/121568109_180388413585019_595391106717307569_n.jpg?_nc_ht=instagram.fmex16-1.fna.fbcdn.net&_nc_ohc=aXLp-eanDvsAX-w-eH5&oh=5e328630888e1f96f4d5058869acd49b&oe=5FB48F66","camiloforero20180594",1,0
"18122336740193505","Son el peor banco que existe en el mundo!!! Pésimo servicio, pésima atención!!! Demasiada ineptitud!!!!!! Llevo 5 meses intentando que me resuelvan mi caso!!! Y a la fecha no han hecho absolutamente nada por ningún canal!!! Siempre dicen que deben seguir escalando el caso!!! Son de lo peor qué hay!!!",1601745310,false,"267092562",false,"https://instagram.fmex16-1.fna.fbcdn.net/v/t51.2885-19/s150x150/119172174_754731068405900_3952376746101677416_n.jpg?_nc_ht=instagram.fmex16-1.fna.fbcdn.net&_nc_ohc=MsddQMjgmV8AX8hb0Pd&oh=81dc0552e156fbd9c52241e6249021ba&oe=5FB4BDEA","paolamaring94",0,1
"17847319790360310","Tengo bloqueada mi clave de bbva net. En la sucursal telefónica no me ayudan y escribo por acá y tampoco contestan. Este banco tiene muchas dificultades para los pagos virtuales. Que pésimo tratamiento para el cliente",1601865340,false,"2206293186",false,"https://instagram.fmex16-1.fna.fbcdn.net/v/t51.2885-19/s150x150/82297674_785710421925685_2687728334120419328_n.jpg?_nc_ht=instagram.fmex16-1.fna.fbcdn.net&_nc_ohc=dcR92-T-GWUAX8ERRT_&oh=5f3339fe3eb994da1fa91b50cf905ed1&oe=5FB3F266","maria_a_n_j",0,1
"17880360715824856","BBVA mal servicio, todos los días me cobran un nuevo saldo, y que llame en 24 horas, Voy a cancelar todos mis servicios con ustedes, NO RECOMIENDO ESTE BANCO, hasta mi cuenta de nomina la voy a cambiar",1601916637,false,"1501058828",false,"https://instagram.fmex16-1.fna.fbcdn.net/v/t51.2885-19/s150x150/12139679_428949763976615_2144035780_a.jpg?_nc_ht=instagram.fmex16-1.fna.fbcdn.net&_nc_ohc=Pb4XJ5YhCAMAX8RcJt1&oh=0d721435610f9ceaa0147237504a685d&oe=5FB2D296","yeya.03",1,1
"17849027552333414","Es en serio que no hay ningún asesor disponible en ningún momento del día? Para que dicen que por el chat si ese tampoco sirve de nada. Necesito un número en el que me conteste UNA PERSONA. Pésimo serviciooooo, pésimo!!!!",1601926230,false,"2081266448",false,"https://instagram.fmex16-1.fna.fbcdn.net/v/t51.2885-19/s150x150/118560333_147292593692713_6564934227408352612_n.jpg?_nc_ht=instagram.fmex16-1.fna.fbcdn.net&_nc_ohc=d9EzociaHWMAX_yvf21&oh=8302d402a5e0c8e05352b2dbffe0c124&oe=5FB4F685","luisaguaqueta",0,1
"18162991009008959","Estoy intentando desde anteayer obtener ayuda de servicio al cliente de es#te banco y es imposible!! El call center no sirve para nada lo remiten a los chats y los chats JAMÁS CONTESTAN Que es esta falta de respeto con el cliente???",1601988879,false,"1821454073",false,"https://instagram.fmex16-1.fna.fbcdn.net/v/t51.2885-19/10554085_997418476935320_1464260245_a.jpg?_nc_ht=instagram.fmex16-1.fna.fbcdn.net&_nc_ohc=MEyIM9RfzIUAX8Ueoxz&oh=3b0740755098713febd940956491e8da&oe=5FB5C302","marianis.pb",0,1
"17855827427240518","Pésimos servicio",1602264394,false,"2223467389",false,"https://instagram.fmex16-1.fna.fbcdn.net/v/t51.2885-19/s150x150/120601510_250425706396612_5683519797807779574_n.jpg?_nc_ht=instagram.fmex16-1.fna.fbcdn.net&_nc_ohc=kZohK_WpZtEAX-8gkUd&oh=30bf586aea420febdb44358146bd2556&oe=5FB4C06A","cmj1351",0,3
"17856078587224613","Pésimo serviciooooo",1602264410,false,"2223467389",false,"https://instagram.fmex16-1.fna.fbcdn.net/v/t51.2885-19/s150x150/120601510_250425706396612_5683519797807779574_n.jpg?_nc_ht=instagram.fmex16-1.fna.fbcdn.net&_nc_ohc=kZohK_WpZtEAX-8gkUd&oh=30bf586aea420febdb44358146bd2556&oe=5FB4C06A","cmj1351",0,0
"18166040038023771","Ladronesssss",1602264413,false,"2223467389",false,"https://instagram.fmex16-1.fna.fbcdn.net/v/t51.2885-19/s150x150/120601510_250425706396612_5683519797807779574_n.jpg?_nc_ht=instagram.fmex16-1.fna.fbcdn.net&_nc_ohc=kZohK_WpZtEAX-8gkUd&oh=30bf586aea420febdb44358146bd2556&oe=5FB4C06A","cmj1351",0,0