"id","text","created_at","did_report_as_spam","owner.id","owner.is_verified","owner.profile_pic_url","owner.username","likes","comments"
"18158224195005743","De que le sirve hacer ese contenido si son el peor banco con el peor servicio.",1597337684,false,"18577722923",false,"https://instagram.fmex16-1.fna.fbcdn.net/v/t51.2885-19/s150x150/69313616_1218866654968218_1591209216217972736_n.jpg?_nc_ht=instagram.fmex16-1.fna.fbcdn.net&_nc_ohc=ZcXKbYYx8-EAX-MhcqH&oh=aefda71784c897c16c2e10c0451cb97f&oe=5FB253AF","zafironegro1989",3,0
"17887284529638570","游눩游낗游눩游낗游눩游낗",1597487920,false,"581564445",false,"https://instagram.fmex16-1.fna.fbcdn.net/v/t51.2885-19/s150x150/91984740_312116873094690_6365876607734775808_n.jpg?_nc_ht=instagram.fmex16-1.fna.fbcdn.net&_nc_ohc=N5Hd2Wx9IMkAX_lHPyy&oh=abe48e75b11f7cfaa6cb0ad8e864446b&oe=5FB6257E","alonsohenao_running",0,0
"17876939050809421","Creo que lo mejor es cerrar la cuenta en @bbva_colombia su servicio es terrible, pesimas las aplicaciones de BBVA , es imposible hacer transferencias desde el celular y uno llama a los canales de atenci칩n para poner la queja y nunca lo atienden.",1598534457,false,"666289113",false,"https://instagram.fmex16-1.fna.fbcdn.net/v/t51.2885-19/11925680_1627403517534594_1020331635_a.jpg?_nc_ht=instagram.fmex16-1.fna.fbcdn.net&_nc_ohc=6FxSeJRWWvkAX8667n1&oh=b103a491a631588111043e403575b081&oe=5FB5AAC7","pedrojuniorcruz",0,1
"17880161386786756","Este es el banco m치s inepto de Colombia.",1598989401,false,"242509152",false,"https://instagram.fmex16-1.fna.fbcdn.net/v/t51.2885-19/s150x150/78950956_1308790152637737_6086789963553177600_n.jpg?_nc_ht=instagram.fmex16-1.fna.fbcdn.net&_nc_ohc=SvC2p-L2qsEAX-EjGI0&oh=74525c931100acff5feeb1c49a66d823&oe=5FB28353","gianaili",0,0
"17898743785559926","P칠simo servicio!!! Que ineptitud para solucionar algo!!! Llevo 4 meses con un caso y no me dan respuesta ni soluci칩n!!!",1599581942,false,"267092562",false,"https://instagram.fmex16-1.fna.fbcdn.net/v/t51.2885-19/s150x150/119172174_754731068405900_3952376746101677416_n.jpg?_nc_ht=instagram.fmex16-1.fna.fbcdn.net&_nc_ohc=MsddQMjgmV8AX8hb0Pd&oh=81dc0552e156fbd9c52241e6249021ba&oe=5FB4BDEA","paolamaring94",0,0
"17858809796149302","P칄SIMO SERVICIO AL CLIENTE DE FORMA VIRTUAL, hagan algo por favor!",1599682738,false,"258299527",false,"https://instagram.fmex16-1.fna.fbcdn.net/v/t51.2885-19/s150x150/82098111_754547788396413_2978006739657424896_n.jpg?_nc_ht=instagram.fmex16-1.fna.fbcdn.net&_nc_ohc=K9SoAKe4Q7gAX8-RGqD&oh=6f23623add2a5d1c9c8d40e91334db9b&oe=5FB56A0F","lcatalinaav",0,0
"17865280949066710","ALGUIEN EN ESTE PERVERSO BANCO PUEDE DAR SOPORTE?",1600347462,false,"3632366612",false,"https://instagram.fmex16-1.fna.fbcdn.net/v/t51.2885-19/s150x150/20589912_1471590549622785_2181384524946997248_a.jpg?_nc_ht=instagram.fmex16-1.fna.fbcdn.net&_nc_ohc=wFcxAe93CeQAX_DkS-S&oh=b8b3087df3386f5e8bd374cddc2cceb7&oe=5FB50001","tecnorafael",0,1
"18148653493076712","Acabo de leer y todos los comentarios son negativos @bbva_colombia,lo cual refleja su mal servicio: acabo de Realizar una transaccion en el centro comercial metropolitano de Soledad-Atl치ntico, donde '' no aparecen'' la cantidad de 1 millon de pesos de la cantidad que iba a consignar, se침ores les aclaro que el dinero se pierde de vista de los clientes, por el dise침o de mueble donde atiende el cajero. No dan respuesta, no dan eficaznmente de las camaras y presionan con frases de '' o consignas o te sales''. No tienen canales para poner la queja, ni de internet ni via telefonica. Es un abuso que llevare hasta la ultinas consecuencias.",1600802343,false,"28650896111",false,"https://instagram.fmex16-1.fna.fbcdn.net/v/t51.2885-19/s150x150/106296486_306280507230892_6745884912117800479_n.jpg?_nc_ht=instagram.fmex16-1.fna.fbcdn.net&_nc_ohc=-XnX1k0oxAMAX8cxp3X&oh=6493c6db8df1c4b303f926bc347501f3&oe=5FB5777A","anzoladavidandres",0,1