"id","text","created_at","did_report_as_spam","owner.id","owner.is_verified","owner.profile_pic_url","owner.username","likes","comments"
"18110755945087813","Buen día, quiero expresar mi inconformidad con la negligencia que tiene el banco hacia mi solicitud, su servicio al cliente es nefasto y no dan solución a mi tramite, estoy solicitando los alivios decretados por el gobierno nacional desde el 27 de abril y nadie responde. A raiz de esta situación me dejaron sun plata, pues para esta entidad financiera prima sus estados financieros y su cartera que lo ordenado por el Gobierno Nacional. Son lo peor, mientras varios bancos ayudan a sus clientes a superar esta siatuació  que vive el país y el mundo entero, ellos lo único que hacen es hundirlo a uno, cobrar intereses moratorios y enriquecer sus arcas. Por favor su intervención @superfinanciera",1593728987,false,"263561402",false,"https://instagram.fmex16-1.fna.fbcdn.net/v/t51.2885-19/s150x150/18161936_290636051378220_75048295730249728_a.jpg?_nc_ht=instagram.fmex16-1.fna.fbcdn.net&_nc_ohc=sLX3oWKj8VEAX8_CLz1&oh=b38484afed0a3dc2ec6a5aa9e4334e5b&oe=5FB2D440","diacarortiz",1,0
"17876259451730449","Terrible que actualicen la aplicación para el 1 de julio fecha en que todos Tenemos responsabilidades que pagar como arriendo y servicios; estando  en plena pandemia donde tenemos limitaciones  de poder salir.
Adicional a eso el envio de mensajes de confirmación al celular se demoran mas de 7 min cuando el tiempo que da la pagina web y la app es de 1min 30 seg en BBVA Colombia",1593812437,false,"294382624",false,"https://instagram.fmex16-1.fna.fbcdn.net/v/t51.2885-19/10707013_552010174931687_1555938667_a.jpg?_nc_ht=instagram.fmex16-1.fna.fbcdn.net&_nc_ohc=biRmg0-GWzgAX-FbYSI&oh=227ec818335dd1b6de0c8b1025b9c1a8&oe=5FB42207","beromana",1,0
"18040916941260590","A este banco deberían ponerle lupa @superintendencia_sic , debido a su mal servicio y a q están aumentando los saldos de créditos, donde se supone por reglamentación presidencial informaron como ayuda congelar las deudas, no aumentarlas. A los usuarios de este banco les recomiendo verificar bien sus extractos bancarios de aprox marzo, a la actualidad donde los montos en lugar de estar tal vez congelados o estables están aumentados.",1594065132,false,"7013836591",false,"https://instagram.fmex16-1.fna.fbcdn.net/v/t51.2885-19/s150x150/39205901_2116514095263704_6437638252756205568_n.jpg?_nc_ht=instagram.fmex16-1.fna.fbcdn.net&_nc_ohc=ZNsWy5uViFwAX9TTenm&oh=085772a0991ab5782207d1ad95d56d00&oe=5FB29487","bohorquezmargareth",1,1
"18067048627246352","INCREIBLEMENTE VOY A PAGAR LA ULTIMA CUOTA DE MI CREDITO Y NO LO PUEDO HACER EN LINEA NO PIENSO POR NADA DEL MUNDO PONER UN PIE EN SUS INSTALACIONES POR MI SEGURIDAD Y NO PUEDO HACER EL ESTUPIDO PAGO???????? Y NO HAY LINEAS DE ATENCION DONDE COMUNICARSE, EL CHAT ES UNA MAQUINA QUE TE DA MULTIPLES RESPUESTAS SISTEMATIZADAS, NADA QUE TENGA QUE VER CON MI SOLICITUD Y EN LAS REDES SOCIALES NOS BLOQUEAN QUE CLASE DE SERVICIO AL CLIENTE ES ESA???? SI NO PUEDO HACER MI PAGO EN LINEA, NO VOY A PAGAR NADA!!! #NoUsoMasBBVA @superfinanciera",1601644366,false,"328683052",false,"https://instagram.fmex16-1.fna.fbcdn.net/v/t51.2885-19/s150x150/101483971_677522626142541_8573400917825552384_n.jpg?_nc_ht=instagram.fmex16-1.fna.fbcdn.net&_nc_ohc=TndpH_2wJZYAX_zzrHI&oh=01ccb5bca0717bf7f6a1479035f25f72&oe=5FB2A702","johis8888",0,1
"18031424518281378","Hay alguien que se pueda hablar que no sea una máquina",1601677304,false,"1306434756",false,"https://instagram.fmex16-1.fna.fbcdn.net/v/t51.2885-19/11849883_705038352934922_1827178151_a.jpg?_nc_ht=instagram.fmex16-1.fna.fbcdn.net&_nc_ohc=8ln5N0v1IT0AX8uC_fq&oh=8c862cc2dfb36bbc183ee47e5e710289&oe=5FB4C4D5","antochaves04",0,1