"id","text","created_at","did_report_as_spam","owner.id","owner.is_verified","owner.profile_pic_url","owner.username","likes","comments"
"18059487787224536","👀 @aliciarosh",1592496274,false,"393171923",false,"https://instagram.fmex16-1.fna.fbcdn.net/v/t51.2885-19/s150x150/110017469_1006877123089702_665444011372592115_n.jpg?_nc_ht=instagram.fmex16-1.fna.fbcdn.net&_nc_ohc=kRKNzQQEeggAX_kPdTv&oh=1f15c246f067ce6c11a86cea86773436&oe=5FB36084","albertodelcg",1,1
"17899941712498606","@bbva a ver si cuidáis de los clientes que menudo clavazo nos habéis metido con las comisiones 190 euros cada 6 meses.....",1592497133,false,"6956228167",false,"https://instagram.fmex16-1.fna.fbcdn.net/v/t51.2885-19/s150x150/120036934_180424700209042_7589446288688826506_n.jpg?_nc_ht=instagram.fmex16-1.fna.fbcdn.net&_nc_ohc=Ee9vUrSCYpAAX-ap-Q3&oh=a2ae1d474f1de968d2f582e9c93c88bc&oe=5FB3F518","mapl0889",1,0
"17870838202796674","Hoy me estafó el BBVA. 313 euros fueron tomados de mi cuenta bancaria. En febrero, fui víctima de un fraude en mi tarjeta bancaria, reembolsada por el BBVA y hoy, 4 meses después, el banco me ha vuelto a embargar el dinero. Sin contactarme. Cuando llamé al servicio de atención al cliente, el hombre me dijo que ""dejó una nota para el departamento"" pero que era imposible hablar con ellos. El hombre dijo, no sé si el departamento te llamará o no, no hay nada que pueda hacer. ¡Esto es una vergüenza! Robas dinero y no hay forma de recuperarlo. Después de COVID, esta es una gran muestra de solidaridad!",1592497581,false,"190096351",false,"https://instagram.fmex16-1.fna.fbcdn.net/v/t51.2885-19/s150x150/82800024_2925132417532754_2328570395596161024_n.jpg?_nc_ht=instagram.fmex16-1.fna.fbcdn.net&_nc_ohc=5Rixk3EN6XoAX8MP5hh&oh=d9108801922ad94ece80bbb8abe107a1&oe=5FB39936","anaislisaroses",2,2
"17884147783613483","👏👏",1592525746,false,"37719342805",false,"https://instagram.fmex16-1.fna.fbcdn.net/v/t51.2885-19/s150x150/108016828_291999885545989_1654376028216533195_n.jpg?_nc_ht=instagram.fmex16-1.fna.fbcdn.net&_nc_ohc=Xp-OCvf9lC0AX--olUX&oh=2e7ce0efd2945b3a9d8b05ac3d71d4b8&oe=5FB558CF","ingordonramsi",1,0
"17886832081590456","A mi me han quitado 200€ en comisiones y dicen que es por que no superé una nómina en los dos últimos meses, los dos meses de estado de alarma, los dos meses de Erte que aún no he cobrado! Sois unos aprovechados por no decir otra cosa, la pienso liar en las oficinas hasta que me devolváis el dinero ayer la lie y hoy vuelvo a liarla! Me lo devolvéis por que me lo devolvéis y punto!",1592545774,false,"497425965",false,"https://instagram.fmex16-1.fna.fbcdn.net/v/t51.2885-19/s150x150/102288837_3028848487210096_3720643118127644672_n.jpg?_nc_ht=instagram.fmex16-1.fna.fbcdn.net&_nc_ohc=HDsskwQ8-akAX8rpveJ&oh=980441f8474c97b79c4b14c9a15b1270&oe=5FB29236","mykototattoo",2,6
"17854879916067908","El banco me ha quitado 53 euros por gasto de comisiones. Y llamo y me dicen porque el los últimos 6 meses tan solo el mes de abril no entro 600 euros. Y le informo que fue porque el gobierno no pago a tiempo mi erte. Y dicen solo que lo sienten. Voy a retirarme de esta identidad bancaria y pasaré mi nómina otro banco.",1592566401,false,"374391850",false,"https://instagram.fmex16-1.fna.fbcdn.net/v/t51.2885-19/s150x150/117372946_187482949590905_4896346229591768540_n.jpg?_nc_ht=instagram.fmex16-1.fna.fbcdn.net&_nc_ohc=xHCkQNrAzp0AX8qGTMQ&oh=0213c0e4b63abcee5fb54b5678e1c994&oe=5FB25A7B","pedrogonzalez13",0,0
"17860341292967588","Que bueno saber este tema... Saludos desde Uruguay..",1592583235,false,"3160195963",false,"https://instagram.fmex16-1.fna.fbcdn.net/v/t51.2885-19/s150x150/67076304_2978319768906342_1593648989570334720_n.jpg?_nc_ht=instagram.fmex16-1.fna.fbcdn.net&_nc_ohc=goP72kARfVcAX_RjuU5&oh=37bc9d909e84469936813276cf2990d1&oe=5FB2E8E9","chefmiguelpladaok",0,0
"17844056567216335","This photo feels so tasty. visit my 'gram because you may like it...",1592607943,false,"964443610",false,"https://instagram.fmex16-1.fna.fbcdn.net/v/t51.2885-19/s150x150/36653894_1062652133897552_2820908969252356096_n.jpg?_nc_ht=instagram.fmex16-1.fna.fbcdn.net&_nc_ohc=1rI4NLHZfQAAX__T-Xe&oh=5afa7199ef4ce9cac2c56fa69fa17145&oe=5FB2EAC1","digitalwong",0,0