"id","text","created_at","did_report_as_spam","owner.id","owner.is_verified","owner.profile_pic_url","owner.username","likes","comments"
"17850742162939134","Pero si no puedo utilizar el aplicativo y el p치gina tampoco me pide el toquen digital y me falla tmb",1584721661,false,"185828462",false,"https://instagram.fmex16-1.fna.fbcdn.net/v/t51.2885-19/s150x150/120825961_250329403088817_7761412154246534390_n.jpg?_nc_ht=instagram.fmex16-1.fna.fbcdn.net&_nc_ohc=uGttyzPrLWwAX_TuZbx&oh=70ee00b3d8dd23c451fab78d82c46a69&oe=5FB5A2AA","jramirez28",0,1
"17881462240531369","Apoyo para las personas que tiene cr칠dito en el banco y no pueden hacer sus pagos",1584726708,false,"1482729825",false,"https://instagram.fmex16-1.fna.fbcdn.net/v/t51.2885-19/s150x150/34820299_225381394930534_5016488889393610752_n.jpg?_nc_ht=instagram.fmex16-1.fna.fbcdn.net&_nc_ohc=FyLU4QFc2sQAX_lGFi1&oh=36ffffe821e340fcde9639dd7f466df9&oe=5FB247CD","camen_av",0,0
"17897803015453625","游녨",1584731356,false,"12522170757",false,"https://instagram.fmex16-1.fna.fbcdn.net/v/t51.2885-19/s150x150/100085082_283280746167935_5362990465534656512_n.jpg?_nc_ht=instagram.fmex16-1.fna.fbcdn.net&_nc_ohc=83q8r0GrLz0AX-exp7K&oh=988766dbf05f0d18362683a50065e68e&oe=5FB35843","favi8901",0,0
"17842051034075651","Dijeron que las transferencias interbancarias iban a estar exoneradas de comisi칩n, pero no es cierto",1584748618,false,"413935225",false,"https://instagram.fmex16-1.fna.fbcdn.net/v/t51.2885-19/s150x150/56821406_428088201312090_8700783196784033792_n.jpg?_nc_ht=instagram.fmex16-1.fna.fbcdn.net&_nc_ohc=clhgzG0BkPEAX-olZCs&oh=620919f9e45473e7c36af3d2e7834e6e&oe=5FB49B9C","datopi",0,1
"17919823483388247","Porque",1584751432,false,"9438811108",false,"https://instagram.fmex16-1.fna.fbcdn.net/v/t51.2885-19/s150x150/45341816_273812836664964_4358072945537449984_n.jpg?_nc_ht=instagram.fmex16-1.fna.fbcdn.net&_nc_ohc=8lhi853EKSMAX_Gu2EZ&oh=96341967f4948203751426c11f91f8c1&oe=5FB4802E","penavillamarialuisa",0,0
"18096803029093991","si uno llama para la reprogramaci칩n de pagos y no responden x porque ya algunos pagos se vencen el 30 y en estA situaci칩n de que no se est치 trabajando queremos ayuda .",1584817019,false,"3992448987",false,"https://instagram.fmex16-1.fna.fbcdn.net/v/t51.2885-19/s150x150/121085892_342448880196685_2627078410537183796_n.jpg?_nc_ht=instagram.fmex16-1.fna.fbcdn.net&_nc_ohc=1fIc9aN1SFEAX_KnNP1&oh=bd2bc8bbc6d2159dbe02e3a5a6e9b480&oe=5FB60193","zahiiramerv",0,1
"17845102034038378","Buenas noches quisiera saber que pasar치 con las deudas que est치n por vencer y no se est치 trabajando. Se pagar치 intereses? Creo que ser칤a injusto si fuera as칤, porque no nos estamos retrasando porque queremos si no por estado de emergencia",1584842797,false,"10175136074",false,"https://instagram.fmex16-1.fna.fbcdn.net/v/t51.2885-19/s150x150/95490862_736439003830441_6861484102474792960_n.jpg?_nc_ht=instagram.fmex16-1.fna.fbcdn.net&_nc_ohc=UmqsJnkcRegAX-A6Skp&oh=0a82384d69a3641d29554a6d91f2285d&oe=5FB57450","chio18105",0,1
"17914626658405840","Es mentiras y el 5950000 no contesta nadie ocuparo alguna otra linea? O por algun chat o wasap?",1584979651,false,"7634847507",false,"https://instagram.fmex16-1.fna.fbcdn.net/v/t51.2885-19/s150x150/31262328_1152907558182038_5375432131092676608_n.jpg?_nc_ht=instagram.fmex16-1.fna.fbcdn.net&_nc_ohc=VpCuZkC__osAX8iqnOl&oh=c8a156a9f3277e9eb6cffa0586648e20&oe=5FB4FF8B","vannesadiandrarouillon",0,0
"17955932242312895","No estan haciendo caso a la norma publicada por la SBS",1584979932,false,"7634847507",false,"https://instagram.fmex16-1.fna.fbcdn.net/v/t51.2885-19/s150x150/31262328_1152907558182038_5375432131092676608_n.jpg?_nc_ht=instagram.fmex16-1.fna.fbcdn.net&_nc_ohc=VpCuZkC__osAX8iqnOl&oh=c8a156a9f3277e9eb6cffa0586648e20&oe=5FB4FF8B","vannesadiandrarouillon",0,0