,text
1796,El día de hoy cambie de celular y uso la app de bbva. Por algún motivo no me permite obtener retiro sin tarjeta. Hablé a la línea bbva y me dicen que debo ir a la sucursal para arreglar el problema. soy de la 3a edad y la recomendación es que no salga. Arriesgo mi vida por este motivo? Qué falta de atención al cliente.
1797,aún esta este banco porque en google no me aparece
1798,Es un banco grande y aunque tiene mucho personal es mucha la gente que acude así que será bueno prevenir tu tiempo
1799,"Pésima atención al cliente.Una persona de la tercera edad tuvo que esperar más de una hora y no la pudieron atender, Optó  por mejor irse.  Es el peors que hemos tenido en una sucursal de Bancomer."
1800,"Atención expedita y funcional ,hay también mas cajeros automáticos  en comparación con otras sucursales"
1801,"Exelente atención aun con personal estresado pero son rapidos los procesos.
Nota: llevar celular con plan de datos. Se llega a ocupar"
1802,Servicio decepcionante.
1803,"Para abrir un estado de cuenta que no tiene ningún costo te hacen pagar un seguro de vida que no es obligatorio,tengan cuidado en esta sucursal"
1804,"muchas, mucha gente!"
1805,Aqui no hay bancomer culeros
1806,Prevé lugar para estacionarte porque hay mucha afluencia de personas... Lo que no me gusta es que aunque pagas estacionamiento es a criterio darle al viene viene.
1807,Es pésimo el servicio super lento y muy groseros los ejecutivos
1808,Terrible atención.
1809,"Pese al lugar, es el peor banco!!!!"
1810,"Abre los Sábados, se encuentra dentro de la plaza comercial"
1811,El servicio y atención son buenos. Tiene buenas instalaciones y de los pocos que hay cercanos.
1812,Sí hay!
1813,"pésimo servicio, como siempre Bancomer deja mucho de que hablar"
1821,Tengo mis asegunes en general con BBVA pero esta sucursal es un caso especial.
1822,"Puedo hacer operaciones  en practicaja, así sea de  madrugada, sin correr riesgo."
1823,Buena atención
1824,Atienden rapido
1825,TIENE TELÉFONO PERO NUNCA CONTESTAN
1826,Elegante
1828,Es una sucursal sin personal comprometído con su actividad. No valoran el tiempo de los clientes. Solo hacen su trabajo porque les pagan. Pero si revisan los tiempos de atención hacia ventanilla o ejecutivo es una espera de 140 minutos. Y…
1829,"Entre a las 12:49 a la sucursal para aperturar una cuenta y son casi 2 horas y aún no me atienden. Al llegar, salieron dos ejecutivos más que dejaron  de atender de la nada, se pararon y se fueron y Solo hay un ""ejecutivo"" atendiendo y esto…"
1830,"25 de Agosto, tiempo de espera para atención de un ejecutivo 4 horas. Realmente muy lento. Entendemos la situación por Covid19 es compleja, pero hay muchos adultos mayores esperando en la fila por 4 horas, no es nada adecuado y agradable."
1831,"Por que si dice un horario de 8:30 a 16 hrs, abren hasta las 9:30. Que es esa irresponsabilidad, o actualicen sus redes, me hacen perder mi valioso tempo."
1832,"Muy mal servicio, cualquier trámite es muy tardado,y en estos tiempos, muy riesgoso"
1833,Pésimo servicio. Hoy fui a  la sucursal Azcapotzalco a las 3:30 y no me quisieron atender por qué ya habían dado las últimas fichas según ellos. cuando tienen un horario de servicio hasta las 4. Se entiende por la contingencia pero para eso…
1834,"Buenas tardes, yo puedo comentar que si hay mucha gente, buena atención, la atención es personalizada, algunos de los ejecutivos te ofrecen discreción al realizar tus operaciones."
1835,Pésimo servicio y pésima organización exponen ahí a las personas a infectarse las tienen formadas y tardan y tardan que banco tan tercermundista
1836,En ésta sucursal te coman las tarjetas y te roban tengan cuidado
1837,La directora de esta unidad es una elitista y despreciable persona.
1838,Es súper tardado llevo más de 2 horas para digitalizar INE
1839,"voy de manera recurrente a esta sucursal y el trato que me han dado los ejecutivos de cuenta a sido bueno, pero es todo lo contrario con los cajeros son pedantes, groseros y no tienen ni preparación, muy deficiente su servicio."
1840,Demasiado tardado.... llevo más de 2 hrs esperando pasar con ejecutivo... pésimo servicio
1841,El personal mal servicio desde la gerente hasta los de la entrada pésimo servicio y ni te ayudan al contrario te perjudica
1842,"Pésimo servicio por parte de los empleados de está sucursal, tarde más de 4 HRS para pasar con ejecutivo y solo para reposición de tarjeta, que empleados tan déspotas"
1843,"Muy malo el servicio, hay mucha gente y de las 8 cajas que hay solo 3 dan servicio."
1844,"La cantidad de Cajeros ATM es relativamente buena, siempre hay cajas sin empleados por lo que se tarda bastante en ser atendido. Los ejecutivos pasan a sus amigos y conocidos antes que a alguien con turno pero la atencion no es muy mala."
1845,Pésimo servicio! Lentísimos
1846,"Pésima atención. Estuve 2 ocasiones más de dos horas en cada evento, solamente para cambiar el número ligado a mi Banca Móvil y en ambas ocasiones no pudieron decirme que no había sistema."
1847,"Pésimo servicio, llevo 2 semanas intentando abrir una cuenta y siempre te ponen un pretexto diferente"
1848,"Pésimo servicio, la gente no quiere trabajar, no te atienden, solo te traten vueltas y vueltas y no te solucionan nada :(..."
1849,Ya casi me piden mi acta matrimonial para apertura de cuenta de cliente se pasan.
1850,"pesima atencion, extremadamente tardado y ademas asaltan en los atm del lugar."
1851,Excelente servicio
1852,Servicio muy mal
1853,"Varios cajero, mucha gente y buena atencion pero es tardado"
1854,"Los cajeros son muy lentos y sean cuidadosos al utilizar los cajeros por la mañana, si se acerca alguien a ustedes ofreciendo su ayuda no la acepten."
1855,Muy buen servicio
1856,"Debería haber la opción de 0 estrellas, Odio esta sucursal, la detesto, el servicio es lento, el personal incapaz, e ineficiente y según su sistema siempre está actualizado y por eso es lento, nada recomendable, vayan a la de parque vía que esta a una cuadra, aquí en un tramite de 10 minutos pueden perder toda la mañana"
1857,Esta cerca
1858,Lo bueno es que cuenta con alrededor de 10 cajeros automáticos
1859,"Tiene todos los servicios, pero es muy lento"
1860,Peligroso en la noche
1861,Siempre hay mucha gente
1880,Los empleados son muy amables. Excelente servicio
1881,"Sucursal  con poco personal está casi siempre vacío,los ejecutivos tardan en atender pero cuando te atienden es rápido el servicio"
1882,Son sumamente lentos y no pasan conforme a turno más bien si los conocen o si es un trámite que a ellos les beneficia.
1883,son una basura de equipo llevo 3 meses   solicitando una aclaracion y nada me da respuesta de nada..-
1884,La persona que está en la puerta asignando turno no se sabe bien los procedimientos para las operaciones que quieres hacer
1885,Pésima sucursal. Nunca he tenido una buena experiencia aquí. Pero estuve esperando más de una hora para ser atendido cuando el papel decía tiempo estimado de 24 minutos. Ni siquiera había mucha gente. Dónde se queja uno del mal servicio.
1886,Excelente y rápida atención. Llevaba meses yendo a otras sucursales y una pesadilla pero aquí desde el guardia nos atendió súper bien pero especialmente una chica llamada Gabriela Sánchez nos atendió y solucionó todo de maravilla... BBVA si cuentan con este tipo de personas cuenten conmigo
1887,"Muy buena atención , gracias a eso el trámite fue muy rápido"
1888,"Yo siempre he tenido buenas experiencias en todas las sucursales de BBVA, no me cambiaría de banco, aquí estoy muy contento."
1889,"Hoy acudí a la sucursal para hacer el cambio de plástico pues se vence este mes, los cajeros 4, sin hacer nada tardan en atender, y cuando me atienden me dicen que tiene que ser hasta el próximo mes el cambio pues aun esta vigente, acudí a…"
1890,Casi siempre hay uno o dos cajeros automáticos que no funcionan. El personal de cajas es ágil.
1891,Más de 40 minutos para intentarme cambiar de nómina y sacar una tarjeta de crédito de la cual nunca me pudieron atender y eso que tenía el turno D002 !!! Pésimo no trabajaban o no querían atender a la gente !!!!
1892,Rapido falta apoyo rn cajeros automaticos
1893,No me activaron mi cuenta y esta bloqueada me tardaron 2 horas para hacerme una apertura de cuenta de obligaron a hacer portavilidad de otro banco y ahora resulta que no pueden ni depositar me
1894,Cajero
1895,Muy tardado y la practicaja la pusieron del lado hacia la calle donde pones a la vista tu depósito en efectivo
1896,Me parece algo peligroso por la noche y con pocos cajeros automáticos.
1899,"Intentaron de cobrarme 10% de comisiones en el tipo de cambio además de los 88 pesos por sacar dinero.
Son los únicos que lo hacen en mexico."
1900,"BBVA Bancomer es un buen banco, esta sucursal está dentro de una plaza lo cual se vuelve práctico.
Desafortunadamente el servicio que ofrecen es demasiado lento, y parece que no saben hacer su trabajo.
Cuenta con 4 cajeros sencillos y 2…"
1901,Sin gente
1902,"Horrible cada ejecutivo de cuenta  mega lento del numero 18 al 21 que era el mio 2 horas!!!!! Imaginen !!!otras personas les dejaron ahi botado  su numero , xq de verdad pesimo servicio en BBVA  antara, y los ejecutivos y gerente igual."
1903,"El día de hoy fue una experiencia grata, entendieron mis necesidades, no tardaron en atenderme. Lo único malo es que sus pantallas para ver los turnos no servían. Pero eso no impidió la rápida atención a los usuarios. Los cajeros ya son más hábiles y trabajan rápido"
1904,"Pésimo servicio, más si no tienes cuenta con ese banco, lentos, torpes, nadie sabe como hacer las cosas. Los cajeros andan preguntando siempre como hacer depósitos o demás transacciones."
1905,"Pésimo servicio, los dos jóvenes de la entrada sumamente groseros, tiempo de espera terrible... Definitivamente la peor sucursal en la que he estado"
1906,perdi dos horas de mi vida
1907,"Pesimo servicio por parte de losde los ejecutivps de cuenta, se tarsan años e atender a la gente aunque no haya nadie en la sucursal. El gerente del banco te trata como si te hiciera un favor atendiendo una queja, es una sucursal muy pequeña para la cantidad de gents que viene. EN GENERAL ES PESIMO EL SERVICIO."
1908,"Muy mal servicio, de nada sirve sacar turno, pasan a gente que viene llegando sin hacerlos esperar. Y los de servicio al cliente no tratan de apresurarse, risa y risa con clientes platicando de cosas no relacionadas al trabajo."
1909,"Pésimo servicio, 1:30 esperando para sacar dinero en caja, lsa personas que atienden la caja se están paseando y siempre hay una caja vacía. Voy a retirar mi nómina de bancomer."
1910,"Pésimo servicio, no dan completa la información para otorgar una tarjeta de crédito y te quieren meter productos que ni requieres, como el cambio de nómina"
1911,"Lo único bueno de esta sucursal, es que se encuentra dentro de la plaza. Sea quincena o no, el servicio siempre es muy lento, además que la concurrencia de la gente. Supuestamente si eres tarjetahabiente tu turno es más rápido, por eso…"
1912,"Muchas cosas malas que comentar sobre esta sucursal, Bancomer me ha decepcionado totalmente gracias a ésta sucursal."
1913,Muy lentos. Mal servicio el director se niega ayudar a los clientes. Tienen bloqueada mi cuenta desde hace 15 días y no m dan solución
1914,No es posible que no funcione ni un cajero
1915,La peor sucursal que he estado de cualquier banco. 40 min y no paso un solo turno con los ejecutivos de cuenta. Y 3 de los 4 no hacían nada.
1916,El tiempo de atención en esta sucursal frecuenteme excede la hora. El personal no tiene una actitud de mejora o solución.
1917,"Pésimo servicio, super lento, falta de experiencia de los asesores, no hay prioridad absoluta para clientes de banca personal y  cuidado con los pagos en caja, se equivocan muy seguido en los montos, revisen bien sus comprobantes"
1918,"Muy mal servicio, el gerente no ayuda en nada y siempre saturado y muy lento."
1919,"Una porquería de servicio, nadie te atiende todos están platicando, no te ayudan nada más te dejan esperando y cuando  pasas te dicen que ellos no te pueden ayudar... Banamex tiene mal servicio pero a este nivel"
1920,"Muy rápida atención, no hay gente por las mañanas"
1921,Buena atención 🤗
1922,"Esta sucursal no cumple con la Ley de Insitituciones de crédito, se niegan a ofrecer productos básicos (tarjeta de crédito sin anualidad) aunque este producto aparece en la página oficial de BBVA Bancomer"
1923,"Es la peor sucursal Bancomer que conozco,  la gente es déspota y el director de sucursal el déspota más grande que ofrece servicios bancarios,"
1924,"Leeeeeennnnntttiiiisssiiiimmmmooossss, en lugar de que sea ágil por ser una sucursal pequeña."
1925,"Pesimo aun
Dos cajeros a medias porque se quedan mucho tiempo con la ventanilla vacia"
1926,NO PUEDO HACER NADA!!!!!!!!!!!!!!!!!!!!!!!!!!! QUE IMPOTENCIA!!!!!!
1927,Es mentira que esta abierto el sábado hasta las 4!!
1928,son los peores tardan mucho en atender
1929,"La será encargada de cerrar la puerta hoy sábado 20 agosto 2016  ( dudo que sea ejecutivo ) con muy mala actitud , debe mejorar el personal nefasto como ella en esta sucursal ni siquiera escucha mucho menos atiende ."
1930,Buena experiencia en atención y comodidad
1931,LA PEOR SUCURSAL!!! El trato que recibes como cliente es pésimo! Deberían cambiar a los empleados
1932,Muy muy lento y el servicio de mala calidad. No parece haber adueñamiento o autonomía de los empleados para tomar decisiones.
1933,"(Traducción de Google) Realmente muy útil. 👍👍🌟

(Original)
Really really useful. 👍👍🌟"
1934,"(Traducción de Google) Nuestra tarjeta fue tragada debido a una máquina defectuosa. El personal de emergencia es extremadamente grosero y deshonesto, y no desea realizar ninguna cirugía.

Si viene del extranjero, NO USE NINGÚN PRETEXTO PARA…"
1935,"(Traducción de Google) ¡El cajero automático NO FUNCIONA!
Dice que acepta cirrus, plus, visa, etc., pero no le permite retirar y bloquear su tarjeta.
Estaba pudiendo retirarme de otros bancos, pero esta máquina Bancomer bloqueó mis dos…"
1936,"(Traducción de Google) Expriencia horrible de servicio al cliente, vino aquí para abrir una nueva cuenta bancaria, el representante en el mostrador me dijo que solo tenía una opción y que tenía un requisito de saldo mínimo de 4.000.00…"
1937,"(Traducción de Google) Demasiada gente muere y pierde tiempo

(Original)
人多的要死，浪费时间"
1950,Excelente servicio
1951,"Siempre hay un solo ejecutivo para atención a clientes, más de una hora en espera. Tan mal servicio que el chico me sugirió ir al BBVA de Portales, que ahí si hay más ejecutivos"
1952,"Servicio rapido no tarde mas de5 minutos en tomar mi turno y que me at atendieran, algunos dias en ciertos horarios se hace fila para los cajeros automáticos pero aun asi no es mucho tiempo facil de llegar y buen banco"
1953,Camino para 8 min metro ermita linea 12 vamos a Atlalilco casa de pach bye
1954,"Hoy viernes 30 de marzo hice un retiro para posteriormente depositar en uno de los cajeros para depósito y sucede que al meter el dinero el cajero no reconoce un billete, por tal razón quito el billete y al no tener más pra reemplazar el…"
1955,Buen servicio lo malo es que hay muy pocas practicajas y se llega a llenas mucho
1956,"Buena sucursal, los cajeros son rápidos y se aprecia, en general el personal es amable."
1957,"Muy amables, con suficientes cajeros"
1965,"No dejan pasar a ventanilla para realizar algún pago o depósito, porque según tiene que ser mayor a 25 mil pesos. Aún teniendo gente formada en las practicajas me negaron ingresar 4 veces a pesar de que le insistí a la señorita. Ya es la segunda vez que no me dejan ingresar cuando quiero ser atendido en persona."
1966,Muy buen servicio. Personalizado. En general aclaran las dudas y resuelven los problemas rápidamente. Cuidado. Nunca faltan ejecutivo que te de información equivocada o que te quiera vender cosas que no necesitas. Pero es de los mejores Bancomer a los que he asistido.
1967,"Sucursal pequeña pero curiosamente no se llena mucho, el problema aquí es si necesitas que te atienda un ejecutivo pues solo hay 2 y se tardan demasiado. No cuenta con estacionamiento."
1968,"Quiero agradecer a la chica que está entrando al banco, ya que tuve un problema con un retiro en el cagero, dando aque el cagero no me fío mi efectivo y ella me soluciono mi problema y me regresaron mi dinero muy rapido, mil gracias más gente como ella 👌"
1969,"Un asco de sucursal, la estúpida ejecutiva del escritorio 1 y el de la caja 2 no saben que el Pasaporte también es un documento de identificación oficial.

Tuve que reportar mi banca móvil y mi tarjeta por robo y no me permiten la…"
1970,Buen servicio
1971,Muy mala
1972,"No se asusten si en las noches hay una persona en situación de calle en una esquina del área de cajero,  no los va a asaltar solo ignorenla. En la mayoría de las veces está limpio el lugar cosa que no importa tanto como la atención. Cuando…"
1973,"Pésimo servicio, muy lentos en la atención, y la responsable de sucursal prefiere tener tres personas en área de turnos que en cajas atendiendo al cliente."
1974,"Lentos, groseros y flojos... Muy mal servicio..."
1975,Churubusco CR-7
1981,Viernes 18 de Septiembre de 2020. Se publica en internet que el banco se encuentra abierto en un horario de 8:30 a 16:00 hrs. Son las 9:20 y el banco permanece cerrado. Hay ligera llovisna y la gente esperando fuera de las instalaciones.…
1982,Buen sitio
1983,"Una pésima atención y más por los dos jóvenes burlones que están en la entrada... Algunas de las cajeras ni siquiera tienen experiencia para brindar una Buena atención al cliente...
De los ejecutivos de cuenta lo mismo... Ni experiencia…"
1984,Se encuentra abierta la sucursal en q horario?
1985,"Horrible atención, llegué a la 1pm a la sucursal y me atendieron hasta las 2:28, me senté en el escritorio, enseguida  le dije al ""Ejecutivo de cuenta"" que mi tramite iba a hacer una apertura de cuenta así como también la solicitud de mi…"
1986,Excelente ubicación y atención del personal muy limpio mucha seguridad te atienden rápido solo en quincena está saturado !!!
1987,"La atención es buena,  lo malo de la sucursal es que a las 3:30 pm siempre que alguien va a aperturar una cuenta o a realizar un trámite, ponen un pretexto para no atender a la gente (ya que salen a las 4:00 pm)"
1988,Muy mala sucursal
1989,"Una sucursal muy pequeña. Las personas que atienden lo hacen de la mejor manera, tiene cajeros automáticos y un pequeño estacionamiento que usualmente está lleno por los mismos carros de los empleados."
1990,"El servicio es lento, parece OXXO machas cajas y solo funcionan dos."
1991,Buen servicio en quincena FULL
1995,"Me queda a tiro de piedra del trabajo, está limpio y como todos las sucursales, es amplio, bien iluminado y fresco. El pero en este y todos, es que nunca falta el empleado que no tiene idea de lo que debería hacer y se te pega como lapa…"
1996,Se tardan muchismo los ejecutivos y no tienen gente
1997,Abarrotado y muy pequeño el lugar
1998,Es de fácil acceso por su cercanía al metro
1999,Mal servicio! Solicite la reimpresión de un comprobante de pago y me dicen que es imposible!!
2000,Buen servicio
2004,"Todos los bancos abiertos, enfrente hay un scotian, pero este banco es el único que cerro... Aún en las primeras etapas cuando todo mundo laboraba normal, Bancomer no... Muy mal Bancomer en tendremos que cambiar a Banamex o scotian ellos no te mandan a la web"
2005,Son muy amables desde que te reciben hasta que te brindan atención.  Como en todo dependiendo el trámite que hagas es el tiempo de espera
2006,"Me atendieron rápido, eso hablando de un banco se agradece"
2007,"No soy muy fan de este banco, pero su aplicación sí es de las mejores!
Ya estoy harto del robo de las instituciones bancarias son los bancos más caros que he visto en el mundo!"
2008,Excelente servicio y rapidez es el único banco que me a atendido en menos de 5 minutos efectúe mi trámite
2009,"Las veces que he ido me han dado muy buena atención, buscan optimizar tiempos y procesos."
2010,Es la peor sucursal no cuenta con personal suficiente y el tiempo de espera es demaciado
2011,Pésimo servicio
2012,Hace 4 meses puse una reseña sobre ésta sucursal . Sobre su lento desempeño en sus actividades y que creen? Me acaban de contestar.....😂😂😂😂😂 . Hasta para éso son lentos 😅😅😅😅
2013,"No sirven los cajeros, siempre tienen problemas"
2057,Pésima atención al cliente dejan pasar a muchos antes que tú el ticket de la tiempo aprox 1 min y tardamos más de 2hrs!!
2058,Perderás muchísimo tiempo en este lugar. Tratos malos con los clientes. Hay un lugar particular en el infierno para estas personas.
2059,"Me podrían ayudar, diciendo hasta que hora atienden en el área de pensionados ? Gracias"
2060,en este momento en sucursal Matías Romero #597 y av. Universidad mucha gente . Para ventanilla y lento como siempre.
2061,Muy amplio y las instalaciones están bien conservadas.
2062,Buena atención
2063,Banco afuera del metro división del norte
2064,"P É S I M O Servicio!!!! Si tienen opción para ir a otra sucursal eviten lo más que puedan ir a esta! La mayoría de los ejecutivos y personal en general tienen una pésima actitud, siempre están de cara y hacen su trabajo con una flojera…"
2065,"Me impresiona la forma en que tratan a sus clientes siendo violentos e intimidantes. Somos una empresas que ya llevan años con ustedes, hace unas horas un socio mío fue a su sucursal #61 y me comento la situación. Nuestro tramite se detuvo…"
2066,"Falta de empatia hacia los clientes en general, mas de una hora de espera para pasar a cajas  de 8 cajas 5 abiertas no creo que no tengan suficiente dinero para contratar mas cajeros."
2067,"Muy deficiente el servicio. Tanto en cajas como el ejecutivo que me atendió, hacen sentir que les da flojera su trabajo. Tal vez es sólo el ejecutivo que me atiende, pero me llevo un mal sabor de boca. Sólo vengo a esta sucursal porque…"
2068,"Si no tienes cuenta en este banco, olvídate mejor busca otra opción, el sistema de fichas te hará esperar mucho, mucho tiempo"
2069,"Horrible, se tardan muchísimo en atender, hay mas de 30 personas esperando y solo un ejecutivo, mal !!"
2070,Tiene un buen servicio
2071,Siempre piden que te comuniques a línea Bancomer y no te resuelven nada
2072,Rápido y ágil.
2073,Actualicen sus números telénicos ¿no?
2074,Creo que deberian de ampliar su horario.
2075,Te atienden muy bien
2082,"Pésimo servicio de esta agencia y de sus encargados, incapaz de resolver problemas, ninguna actitud de servicio, es lamentable!!

El servicio no es responder un comentario de Google!
Es contestar el teléfono, no colgarle a la gente cuando…"
2083,Muy buena la atención
2084,"que  pasa  y  el  telefono  de  la  sucursal ????    pedregal, es  lo  que necesito,  no   que  me  manden  a  servicio  a  clientes  en gral  !!!!!!!!!"
2085,¿QUE NUMERO DE SUCURSAL ES ?
2086,El servicio es de lo más despótico en esta sucursal.
2087,"Es buen banco y si hay gente, te ayudan a hacerlo por máquina, son muy amables !!"
2088,Buen servicio buena sucursal moderna
2089,Excelente servicio y muy eficaz de los pocos bancos en el que veo que todas las cajas están funcionando y siempre hay alguien al pendiente de lo que necesites para tu trámite.
2090,Muy mala atención de la gerente de sucursal con muy mala aptitud
2093,Hasta el momento mala el cajero MM3492 se quedo mi cambio el 02 de Febrero..levante mi reporte y después de 24 días me dicen que no que es improcedente..y leí con impotencia que son varios los clientes que ha pasado lo mismo y quién…
2094,"Sus cajeros son un asco, se trajo mi dinero y no pude realizar un depósito, he echo muchos depósito en BBVA y nunca me había pasado"
2095,"El banco tiene bastantes cajeros automáticos para el uso de los clientes, las cajas son rápidas y el personal que atiende es bastante atento y atienden de excelente manera, el único detalle es que se encuentra en una zona bastante insegura,…"
2096,Nefasto el cajero se trago mi dinero
2097,"Muy bien esa remodelación reciente a todos los bancomer, ya puedes hacer depositos desde los cajeros. Y es mas rapido."
2098,Oye n y eeeeu de
2099,Siempre hay mucha gente
2100,"MUY AMPLIO, SEGURO Y CON MUCHOS CAJEROS"
2101,"Buen servicio, aunque un poco complicado para estacionar el auto"
2102,El mejor banco de México
2103,buena ubicación
2104,"Buen servicio,  varios cajeros automáticos"
2105,Vayan a otra sucursal si no desean estar más de 1 hora esperando y con 2 personas delante de ti en servicio ejecutivo
2106,Bien ubicado
2107,Rápido
2115,"Excelente atencion por parte del banquero personal Jose Alberto Orozco. Muy amable y profesional. Me ayudó paso a paso durante todo mi proceso de reposicion de tarjeta de debito y adquisicion de tarjeta de credito, explicandome a detalle los beneficios. Muy contento con su servicio!!"
2116,Es bastante lento para pasar con un ejecutivo. No hay personal para atender. Pésimo servicio. En espera de 72 horas...
2117,"Los ejecutivos no sirven nada.
Tomé un ticket para abrir una cuenta y indique que hay unos 45 minutos de espera.
2 horas después, atendieron solo un cliente y me faltan 8 más mientras que puedes ver todos los ejecutivos, atendieron a nadie…"
2118,"Pesimo servicio apestan 3horas para pasar con un ejecutivo,por que estan desayunando y despues chismeando se quedaron cortos al lado de una oficina de Gobierno"
