,text
2564,"Si tienen la mala suerte de ser víctima de robo, este banco será su peor enemigo. Pues me robaron tarjeta de banco, INE, licencia de conducir y celular. No aceptan otras identificaciones oficiales como Pasaporte o Cédula profesional; por lo…"
2565,Basura de banco. Atención pésima y tardan horas en atenderte. Los que no son clientes tardan hasta 2 horas para un deposito y solo quieren que tramites tarjeta de crédito y me acaban de decir de manera grosera que solo una persona puede estar en la caja. Son una empresa pendeja y deberían dejar de dar servicio.
2566,"Horrible atención!! Quieren que pases a los cajeros forzosamente, yo quería hacer un depósito e insisten que pases a los cajeros automáticos y no a ventanilla; sin embargo eso se entiende el día de hoy ya que no había sistema. Sin embargo…"
2567,Buen servicio
2568,El servido es rápido
2569,Alguien sabe si abre los sábados?
2570,"A sido la peor experiencia en un banco, hice un pequeño depósito y la caja se marcaba activa, no me dio mi cambio al terminar el depósito, y enseguida se marco como fuera de servicio, me quedé sin  mi cambio y la respuesta fue que pasará al…"
2571,Pésimo servicio
2572,"Dos horas y media en el banco Bancomer FORUM BUENAVISTA  y no supieron hacer transferencia internacional. Por favor , capaciten a su personal! Pobre joven que intentaba y no tenia a nadie para ayudarle. Ningun gerente, asesor, nadie para…"
2573,Demasiado tiempo de espera los ejecutivos  solo están dando vueltas. Perdí medio día y había muy poca gente
2574,Realmente me sorprendió el did de hoy por las 12pm muy rápido y eficiente el servicio
2575,"Sucursal grande, acude mucha gente, el sistema de turnos es muy tardado, para aperturar una cuenta  espere casi 2 HRS,  los ejecutivos le dan preferencia a sus ""clientes"" y los atienden aunque ya estén con otro cte"
2576,"muy buen servicio, pase rápido con un ejecutivo, resolvio mi problema, después de varios intentos, era un caso complicado."
2577,"Es un poco difícil encontrar esta sucursal. Hay que subir por unas escaleras que están por la entrada de Insurgentes, está a un lado de Interlingua y de Carls JR."
2578,"El gerente es un inepto. Tuve un problema muy fuerte con un depósito que no se vio reflejado, me tuvo hora y media en lo que encontraba un pretexto absurdo para ""salirse"" de la situación. Entendí todo cuando una semana después lo vi…"
2579,Muy amable el personal aunque las filas suelen ser largas al igual que los tiempos de espera para ejecutivos.
2580,Desde que lo ampliaron ha mejorado mucho el servicio. Muy bien!
2581,Pésimo servicio en este y cualquier sucursal siempre diciendo he no tienen servicio y para  haces un trámite y siempre tienes que arreglarlo en la sucursal que lo hiciste no importa que estés sercas de otro te rechazan pues no son un mismo banco?? Asco de banco
2582,"Te quieren obligar a contratar un seguro en caso de apertura de cuentas. La sucursal es muy pequeña para la demanda. Recomendación: si necesitas ir los sábados, hazlo antes de las 11:00 a.m."
2583,Se encuentra arriba del hsbc y a un lado del interlingua y carls Jr... Hay 8 cajeros disponible
2584,Muy amplio muchos cajeros
2585,Discupen abren los sábados osk hay su ursalq abran los sabados
2586,"Desde la última remodelación hay más cajeros automáticos y prácticajas, no hay que esperar mucho para ocuparlos. Los sábados es común que haya bastante gente dentro de la sucursal dado que es pequeña."
2587,"Con la remodelación que hicieron, ya hay muchos cajeros, para poder dar servicio a la demanda de usuarios."
2588,tu muy bien dveria d aver maz zukurzalez abiertaz loz zabadoz
2589,"De las pocas sucursales bancarias que abren los sábados también.

Ir día de quincena, previo a día feriado oficial o en inicio o fin de semana, ¡es caótico! tardando hasta 2 horas en llegar a ventanilla. En los mismos periodos, la fila del cajero suele ser de más de 30 personas."
2590,"excelente atención a cliente, aunque si es largo el tiempo de espera y más en quincena"
2591,"hola, el dia de hoy fui a retirar dinero con una contraseña y me lo dieron incompleto, que puedo hacer? me di cuenta ya muy tarde, ya cerraron :( ayudaaaa!!!"
2592,"Fui el sábado pasado y me dijo la tipa de la puerta que la sucursal la cierran a las 2:30 no a las 4:00 como dice aquí, además que son super prepotentes y groseros... :("
2593,Los cajeros se encuentran en la parte de arriba a lado de Carls jr
2594,"Está demasiado escondida, deberían de poner letreros..."
2595,Peor banco del la CDMX
2596,De casualidad ese banco está abierto para atención a clientes ?
2597,Excelente servicio
2598,Dicen estar abiertos los sábados. No es cierto.
2599,Mal servicio mucha gente las cajeras no quieren trabajar el peor que he conocido
2600,"La sucursal está abierta,?????"
2601,"Este banco tiene buen servicio, se encuentra dentro de las Plaza Pericentro en el primer piso. Estas muy escondido, pero la ventaja es que no hay que hacer muchas filas."
2602,"Buen banco, peor la plaza y el lugar no es el mejor, los empleados son un tanto toscos al atender y no siempre dan el mejor servicio, lo bueno es que tienen horario sabatino y te saca de emergencias, también cuenta con un solo cajero de los nuevos para operaciones bancarias que esta disponible todos los días"
2603,"El horario esta mal, hoy fui y me comentaron que cierran los sábados a las 14:30 y en los horarios vienen las 16:00."
2604,Pésima atención!!!
2605,"Da miedo está Plaza, es muy sola y yo no iría a ese cajero"
2606,Abren los sábados de 9:00 a 2:30
2607,"El horario sabatino esta mal, cierran a las dos de la tarde ni siquiera 14:30 el personal lleva prisa por irse y casi te cierran la puerta en la nariz."
2615,"De las 3 practicadas qué hay, en ninguna se puede hacer depósito. 2 están pasmadas."
2616,A fuerzas te quieren dar dos tarjetas para que pagues las dos
2617,Los cajeros no tienen efectivo
2618,"Está muy bien la atención de algunos ejecutivos, en general es rápida la atención. Pero debido que es el único en un radio de unos 4Km. Pues las quincenas hay demasiada gente de ahí en fuera muy buen servicio"
2619,"Sucursal pequeña, creo que no es suficiente dado que en la zona es la única que existe. En horario diurno siempre encontrarás personal apoyándote en caso de dudas."
2620,"Buen servicio, siempre está limpio en las mañanas, no tardas mucho en realizar tus operaciones"
2621,El servicio es muy malo de las cajeras.
2628,"Cerrado totalmente, no hay servicio supuestamente por protocolos de seguridad, tampoco se pueden usar los cajeros automáticos ya que de igual forma están cerrados, te sugieren ir a la sucursal de Buenavista o a la calle Londres, tremenda estupidez cerrar la sucursal."
2629,Ayer fui y decía que iba a estar cerrado por casos de covid. Deberían de avisar en sus redes y no hacernos dar una vuelta en vano.
2630,"Es el banco más ostil, por teléfono es orrible pasar la vida en el menú escuchando grabadoras que no resuelven nada. Sus plataformas hechas para vender no para servir, sus ejecutivos incapaces de resolver problemas,lo refieren a uno a otra…"
2631,"En los cajeros automaticos por las noches los ""vigilantes"" no te dejan pasar aunque no hayan cerrado las puertas"
2632,"Un banco con muy buenos servicios financieros
.... muy buena opción para ahorrar
.... Buenas opciones en tarjetas bancarias
.... Suficientes sucursales en las ciudades
.... Cajeros automáticos muy innovadores
.... Servicios al cliente…"
2633,"Llevo 70 minutos esperando a pasar, normalmente no tengo quejas de su servicio en ventanillas, pero para dar con ejecutivos es un suplicio."
2634,"El área de cajeros es usada por las noches como dormitorio de indigentes; entiendo que la zona esta pauperrima, pero deberían hacer algo al respecto, en la madrugada con los indigentes dentro no es muy confiable sacar dinero. Eso sin mencionar el mal olor que se encierra, a mona y orines."
2635,"Ya esta abierta de L-V con Horario de 10:00 a 16:30 Hrs (contingencia).
Y Abre los sábados de 9 am a 2.30pm
ATM  de L-D de  8:30am a 23:59pm
Esperó  les sirva"
2636,Ya no abren
2637,"Muy renovado, mucho personal, pero lentos como ellos solos... Todo para decirme que mi tarjeta de nómina ya estaba cancelada en automático?! Pues gracias por nada!"
2638,"El personal es incompetente, hacen lo posible para no trabajar. Me tuvieron esperando una hora para que al final me dijeran que no podían realizar mi transacción porque no servían los biometricos, cuando la señorita de la entrada me…"
2639,"En Referencia A los Ejecutivos, Enrique y christian.
Muy buena atencion."
2640,Muy eficiente el servicio en ventanillas.
2641,Para realizar un deposito es una eternidad.
2642,Se van a comer y no atienden. Pésimo servicio y trato.
2643,"Una hora con dies minutos para que se dieran cuenta que mi cuenta esta bloqueada y que necesitaba ir a la sucursal donde hice la apertura, y en ese lapso de tiempo 6 personas más molestas por su servicio.

Pésimo servicio, por esas razones los robots nos están supliendo."
2644,Excelente el trato muy amables atienden rápido excelente servicio
2645,"A las 9 am solo tienen 2 ejecutivos en servicio de 5 que tienen disponible, muy mal sevicio y el ticket que te dan dice tiempo de espera  aproximado 3 min. Es una falta de respeto, no hay compromiso con el usuario, no hay calidad de servicio."
2646,"Fui hoy para que me ayudarán con un problema con la banca en línea, tenía el turno B014 y un chico me estaba ayudando muy amablemente, pero no pudo resolver mi problema, así que pasé con un ejecutivo, pero me atendió la persona más…"
2647,Nada más se la pasan revisando su celular los ejecutivos y atienden hasta que ellos quieran
2648,"El servicio en ventanilla es muy bueno, el personal es amable y cuenta con varios cajeros lo que hace que el servicio sea más eficiente que en otras sucursales"
2649,"Es la peor sucursal de bancomer que conozco me ha tocado ver a ESTÚPIDOS por que no conozco otra palabra mas adecuada gritarle a las personas por no haber respetado ""su lugar en la fila"", todos los presentes nos quedamos atonitos, no…"
2650,Buen lugar sin tanta gente todo bien
2651,"Mal servicio, tardan horas en atender y no está diseñado para atender personas con discapacidad ya que la sucursal está en segundo piso y solo hay escaleras."
2652,"Si existe, está en la esquina de Sadi Carnot y Rivera de San Cosme, y si su personal es muy grosero y sobre todo su Director todo mal encarado siempre y de mala gana te atiende."
2653,"Ejecutivos muy prepotentes, te quieren vender un seguro de tarjeta como requisito para poder sacar una tarjeta de Nomina, el gerente es peor de grosero. PÉSIMO SERVICIO, si les hes posible no vayan a esta sucursal."
2654,"Aki no hay ningún bancomer, si no fíjate en el street view!!"
2655,Esta sucursal está sobre San Cosme
2656,Rápido servicio
2657,Si te dan un cheque de este banco y lo quieres cobrar no siendo su cliente las esperas son realmente eternas.
2658,Bien
2659,"Mal servicio. Pésimo. Son novatos el personal que labora en esta sucursal, pero se sienten los expertos, los chingones del mundo. Tardan demasiado en atenderte. Mejor ve a otra sucursal, que bueno que no es la única que hay."
2660,Una gran cantidad de cajeros pero jamás funcionan
2661,"Buen servicio y rápido, además abre los sábados."
2662,"Cuenta con varios cajeros automáticos, lo que hace que las operaciones sean rápidas"
2663,"Pésimo servicio, súper ineficientes"
2664,De los peores bancos en México y en especial esta sucursal.
2665,Siempre lleno de gente
2666,No existe
2667,No existe esta sucursal
2678,"Mal, fui el pasado viernes, se fue el sistema, dieron información errónea de la falla del sistema, de mala gana le decían a los clientes que no había sistema y que era nacional, entre dos empleados se estaban peleando verbalmente porque uno…"
2679,"Saben que los cajeros se tragan las tarjetas y aún así los tienen operando.
Pésima comunicación entre los mismos empleados no saben nada, ni dar una respuesta, estuve tipo 40 min y hubo 3 quejas en ese mismo tiempo."
2680,"Estoy esperando desde las 2pm para ver algo con mi aplicación y ya son las 4pm son muy lentos y meten a gente que apenas va llegando con ejecutivos ,nada recomendable ,mucha perdida de tiempo ,no respetan el turno"
2681,"Es basura, esperando mas de 1 hora para ejecutivo, el lugar Sin gente y no hacen su trabajo, es en momentos como ese que recuerdo lo afortunado que soy al tener mis tarjetas mercadopago y bankakool, bancuchos como estos deberian desaparecer…"
2682,"La peor sucursal del peor banco. Los empleados se sienten dueños del banco y ellos afirman que si no vas a depositar y llevas en efectivo al menos 25,000 pesos no tienes derecho a pasar porque solo les haces perder su tiempo. Esta situación lleva meses, no sé cómo Bancomer permite algo así."
2683,"Es una de las sucursales que más visito y a pesar de que con bastante regularidad está limpio, el ambiente es agradable, los colaboradores son atentos y los trámites se hacen ""con facilidad"", tienen un horrible detalle que los arruina…"
2684,"Muy buena atención sobre todo si eres amiga de la Cajera Sandra porque te dejará pasar sin importar tu turno, iba el conteo en el 55 y su amigo traia el 61 y lo atendió primero, importandole poco que hubiera muchisima gente. Super mal por…"
2685,Pesima atención y servicio dudoso ya levante mi queja ante la unidad UNE de BBVA
2686,Servicio rápido y eficiente excelente trato del personal
2687,Aquí siempre venía a hacer depósitos y siempre súper lleno. Preferible ir a la prácticaja del otro lado de circuito interior.
2688,"La atención no es buena, la sucursal es un poco chica por lo cual se suele acumular la gente y hacer grandes filas."
2692,"Pésimo servicio están varios ejecutivos y no atienden
Te hacen esperar más de dos horas y no dan solución"
2693,Cajeros automáticos y Practi-caja abierta durante cuarentena.
2694,El teléfono que muestran no es de la Sucursal Bancaria sino el de Línea BBVA y este menú no te permite contactar a la Sucursal 🙁
2695,"Karen Olaya me trató súuuuper bien, una chica súler amable y atenta, me atendieron rápido y de excelente modo. Excelente servicio.  👐"
2696,"fui a depositar a la prácticaja $2500 pesos , eran como las 5:30 pm y se atora ron los billetes eran puros de $50 ya no me los regreso y jamas salieron de la sucursal habiendo ejecutivos en su horario fui al día siguente y la gata q tienen…"
2697,Excelente servicio la práctica funcionó correctamente
2698,"los ejecutivos no dan soluciones a las necesidades de los usuarios, solo dicen qeu debemos de llamar a bancomer para que nos ayuden"
2699,"Pésimo servicio, mala atención, trato desagradable, no dan seguimiento a requerimientos, no tienen idea de lo que es calidad, es una pena que personal como el que trabaja aquí haga quedar tal mal a esta institución."
2700,Parece q te hacen un favor.
2701,Oficina bancaria con instalaciones modernas
2702,"Pesimo servicio , no tienen gente en espera y aun asi no te pasan. Espere 30 min para un ejecutivo. Queria sacar una tarjeta de nomina y no pudieren asistirme. Lleve los documentos adecuados pero aun asi no supieron como ayudarme. No tenian las ganas ni la etica para asisitir al cliente. Muuy mal."
2703,El banco
2704,"Un poco oculto y cierran los cajeros al mismo tiempo que la sucursal, aceptable para la zona."
2705,Excelente atención
2706,"(Traducción de Google) Mst

(Original)
Mst"
2712,"El horario dice que abren a las 8:30 am y son 9:30m no es posible tener tanto retraso.... Llega el personal a desayunar?
Hay más de 40 personas esperando y una vez que abren de cuatro ventanillas solo trabaja una. No puede ser posible.…"
2713,"Pésimo servicio, los cajeros no funcionan y cuando tienes suerte sirve solo uno, lo cual hace que estés mucho tiempo formado para pagar algo y más en temporada de reinscripciones"
2714,"Pésimo servicio...
Horribleee

XD ni vayan."
2715,"Por qué en la página dice que abren alas 8:30 y son las 9:10 y aún no atienden...🤔
Pésimo servicio 🙄"
2716,Que malo que vallas con toda la confianza de que el banco estaba cerrado pero sin en cambio el maps dice que esta abierto
2717,Un pésimo servicio donde prefieren tener a gente esperando mientras desayunan no mendigamos dinero vamos a cambiar o bien depositar el dinero que ganamos con nuestro trabajo
2718,Quisiera saber porque dice abierto desde las 9 y son 9:56 y no atienden 🤔
2719,"Siempre que voy a esos cajeros o PRACTICAJA se terminan quedando o mi dinero o el cheque, los cajeros automáticos son pésimos en cuanto al banco tiene buena atención"
2720,"El espacio es reducido en el área de cajeros automáticos por lo tanto tendrás que hacer fila afuera exponiéndote al sol o al mal clima.
El personal no sabe lo que hace y en ocasiones llega a ser grosero. La gerente es una incompetente ya…"
2721,Pésimo servicio 😬
2722,Pésimo servicio 😒😒😒
2723,"La atención deja mucho que decir y hago referencia a el tiempo de espera, para que un ejecutivo te atienda el tiempo de espera es de 2 horas, ni es una sucursal que recomiende"
2724,"Una sucursal pésima la atención del personal a la entrada  no da las fichas correctas  Srita .Andrea Espindola.
Y los ejecutivos en su atención lenta y  despota."
2725,Buen lugar para perder el tiempo hay una chaparrita que aparte de hacerte jetas te da mala información un Ejecutivo que no atiende a la gente como va llegando y eso causa molestia pésimo por parte del personal
2726,"Tardan muchisimo, no tienen buena organizacion"
2727,No tienen gente y aún así hacen esperar a las personas que van a pasar con un ejecutivo tengo una hora y solo hay 2 personas y solo pasan a una y hay varios ejecutivos y no pueden atender
2728,Me dieron informacion falsa y el servicio es grosero
2729,Un servicio muy pero muy tardado 😨😭
2730,"Pequeña la sucursal para demasiada gente, para hacer fila en cajeros estas afuera y si hace sol te quemas además que luego no es rápido la atención en cajeros automáticos además que no hay organización para pasar a ellos, los cajeros luego dejan de funcionar. Lento en servicio de ayuda con un ejecutivo."
2731,Pésimo servicio.
2732,"Buen trato, a mi por fortuna me tocó llegar antes de que empezará a llegar mucha gente y me atendieron rápido pero si hay mucha gente y es pequeña la sucursal"
2733,"Buen servicio al cliente y las ventanillas son rápidas, la verdad es que muy contento con el servio otorgado por esta sucursal"
2734,"Horrible, tardas mucho tiempo, el espacio es reducido y tienes que hacer fila afuera, con lo lindo que es hacer fila y esperar bajo el rayo del sol... (nótese el sarcasmo)"
2735,"Mal servicio por parte de los empleados, parece que nos están haciendo un favor, mala organización, no nos apoyan en el uso del cajero, mala atención en las ventanillas, deberían capacitar más al personal."
2736,"Personal amable, estructura de organizacion interna buena :D"
2737,"Pesimo servicio, teniendo ventanillas libres ahora es obligatorio pagar en cajero  y solo hay uno."
2738,"Excelente banco, el mejor de todo el país."
2739,Mucha gente y no agilizan la atención
2740,Pocos cajeros y mucha gente
2741,Servicio deprorable!!
2742,"Mal , los cajeros lentos , el personal grosero , etc"
2743,Buen servicio
2744,Sus cajas prácticas son muy lentas y a menudo no sirven .
2745,Funciona aunque podría mejorar
2746,Lento
2747,En ocasiones un poco lento.
2748,"Si vas a ventanillas se tardan demasiado, y los cajeros siempre están llenos."
2760,"Buena atención, buenas medidas de seguridad en la nueva normalidad."
2761,No abren a la hora es
2762,"Lleva dos reportes de asalto. Acaban de asaltar a mi familiar. El Nuevo Director Ricardo Martínez protege a los presuntos responsables, no resolvió nada a favor."
2765,"Muy buena atención y el personal amable, nada que ver con la sucursal de colegio militar."
2766,"Esta sucursal se mudó cruzando la calle, a la esquina del centro comercial Parques Plaza."
2767,"Excelente, atención rápida y desde un principio te asesoran al 100, me encanto que no pusieran tantos peros para la apertura de una cuenta, encantado."
2768,"Muy buena atención, es rápido y ayuda mucho que hay estacionamiento"
2769,"La Atencion al cliente es lo peor, te hacen esperarte aunque tengas cita; para que no te solucionen nada. Nefasto su servicio, sin saber sus horarios de apertura y su encargada muy distraída."
2770,Muy amplia la zona de cajeros
2771,"Desde el cambio de domicilio, el área de ejecutivos es muy lento, incluso cuando te toca la atención, puedes notar que no hay ejecutivos atendiendo en los cubículos del fondo, son como 4 cubículos. Por lo regular te atienden los 2 cubículos frente a ventanillas y los 2 primeros pasando  la dirección."
2772,Hay atención y eso es bueno
2773,Buena atención. Se ve cuando el personal trata de que su atención sea óptima. Me agrada venir a realizar pagos a esta sucursal. Ya que hasta en horas pico no tardas tanto tiempo
2774,Posee dos súper cajas... sugiero instalar una más
2775,Son muy muy lentos las 2 ocaciones q lo visite me tarde 2 horas 15 min y la directora es muy engreida y grosera le pedi ayuda y me dijo q mr iva a sacar  que si me parecia el trato bien si no q me fue q existen mas sucursales .... fue mi…
2776,"Son unos ladrones.
Cobre un cheque de un monton grande y ya para no correr peligro lo conte cuando estaba en la seguridad de mi casa. Me dieron menos y cuando fui a quejarme me dicen que el corte de caja esta completo....
LA CAJERA…"
2777,Excelente servicio rápido y muy amables
2778,Excelente ubicación y fácil acceso
2779,Es una sucursal que tratan de apurarse en la atención del servicio.
2780,¿Hasta que hora cierra de lunes a viernes?
2781,Muy tardado
2782,Buen servicio y bastante atención
2830,Nada de seguridad en el área de cajeros! Si necesitan ir mínimo vayan acompañados para evitar robos! Aparte el teléfono que tienen instalado para atención al cliente ni sirve!
2831,"Sucursal adecuada para cajeros automáticos ya que aunque tiene estacionamiento en sótano, es muy engorroso, normalmente te estacionas en lugar pequeño al lado de edificios y vas a hacer tú movimiento rápido a los automáticos.
Si vas a cajeros de persona, normalmente mucha gente y ahí del número vque te toque en ficha"
2832,"Hola, en el portal de BBVA no hay información sobre el numero de la sucursal, alguien podría decirme por  favor cual es el CR de esta sucursal, el mapa del portal no funciona. gracias"
2833,Pésimo servicio y atención por parte del personal si no eres cliente del banco te hacen esperar por más de una hora para hacer un simple depósito con el simple pretexto que como no tienes cuenta tendrás que esperar a que atiendan a todos
2834,"La peor sucursal de la vida. La gerente te trata con despotismo y los ejecutivos están, en general, desorientados.
Pasé con alrededor de 20 personas esperando nuestro turno por una hora; el sistema de conteo estaba averiado pero nadie pudo…"
2835,Cajeros funcionales
2836,"Es el banco que uso habitualmente y siempre había pensado que su servicio es excelente, y así lo había manifestado en las encuestas de atención. El día de hoy al preguntar por un trámite especial me dijo el chico que daba los turnos que lo…"
2837,Que número de sucursal es está perdón ???
2838,Buen trato
2839,Me regalarían el número de la sucursal porfavor 🙏🏻🤗
2840,"Yo tenía cuenta en ese banco y la cancele porque me quitaron lo poco que tenia, según por manejos de cuenta, no manejar un mínimo de saldo."
2841,"Nunca tienen ejecutivos suficientes, las tres veces que he ido, he esperado taaaanto que al final me desespero y me voy. Hasta más de una hora para pasar."
2842,"Por lo regular está demasiado lleno, no recomiendo hacer depósitos en ésta sucursal en quincenas!"
2843,"Exelente ubicación!
Instalaciones agradables y modernas.
Servicio de cajero automático.
A 5 min del estadio azteca.
cercano a periférico unos 500."
2844,Buen servicio n.n
2845,adecuado servicio
2846,"También abren los sábados, al igual que los Bancomer de algunas plazas del Sur de la CDMX"
2847,Perfecto
2848,"Típico bancomer, en horas pico es muy tardado."
2849,Muchos cajeros disponibles
2850,Buen lugar trato amable
2851,Pésimo servicio..en todos los aspectos..
2852,Bancomer no tiene el mejor servicio. Por el contrario.
2853,Para urgencias tiene cajero
2854,Como es posible que tengan un banco y uno requiere el banco el fin de semana lo tengan cerrado los cajeros eso esta mal por parte de ustedes y uno no se puede trasladar a otro banco como sugerencia y yo se que no haran nada
2855,"(Traducción de Google) ¡¡Muy lleno!! Mejor evitar en las horas pico

(Original)
VERY crowded!! Better avoid at peak hours"
2856,"(Traducción de Google) CR-3476

(Original)
CR-3476"
2864,Ayer lunes 4 mayo dejé mi camioneta en el valet del estacionamiento del banco y al llegar a mi oficina me faltan 5 discos de PS3 que traía en la parte tracera que subí antes de ir al banco. Llegué 9:30 y salí hasta casi las 11.…
2865,Respetan todas las normas de seguridad y el tiempo de espera es moderado a pesar de tener mucha gente debido a las sucursales cerradas
2866,"Después de ir a otra sucursal, llegue temprano a esta sucursal en especial y en quincena y no había mucha gente (si vas temprano 8:30 -9:30 esta casi vacía) atendió una Ejecutiva Carmen Guzmán que me dijo que estaba de apoyo la semana…"
2867,"Buena ubicación, cuenta con estacionamiento"
2868,"Solo existen 4 cajas, y no todas están atendiendo, esta sucursal es muy muy muy concurrida.
De 30 minutos a una hora de espera.
Los empleados están condicionados a pelear con la gente. No te dan turno si la sala de espera está llena, así…"
2869,filas eternas.
