"id","text","created_at","did_report_as_spam","owner.id","owner.is_verified","owner.profile_pic_url","owner.username","likes","comments"
"17890913350564564","Partida de incompetentes,. No atienden las líneas, los números que atienden no son lo canales adecuados, dan vueltas y vueltas en el ivr",1595337311,false,"8345612403",false,"https://instagram.fmex16-1.fna.fbcdn.net/v/t51.2885-19/s150x150/79910209_2501200413479479_5046390035096535040_n.jpg?_nc_ht=instagram.fmex16-1.fna.fbcdn.net&_nc_ohc=PXeMObTWCJcAX_EoRex&oh=0c65abbd0e8d09c05208f3fb924ee0e9&oe=5FB59693","misaelalvarado23",0,0
"18109610944176888","Limpien y desinfecten mas seguido los cajeros automaticos que son una mugre y alta fuente de contagio.",1595337419,false,"2537916465",false,"https://instagram.fmex16-1.fna.fbcdn.net/v/t51.2885-19/s150x150/81611011_696201584537508_3322612177062495892_n.jpg?_nc_ht=instagram.fmex16-1.fna.fbcdn.net&_nc_ohc=1XsWrd-v4sUAX_mhuVC&oh=9b1dfb59db1aa95a88f7eaaf7a1b027a&oe=5FB621E1","m.lujancastro",1,1
"17876084554759617","Hola tengo que hacer un reclamo porque quiero hacer un desconocimiento de cuenta y en el call nadie atiende, por la pagina no carga el formulario UNA VERGUENZA!!!! Como hago para comunicarme con alguien que me resuelva mi problema???",1595337448,false,"7163227532",false,"https://instagram.fmex16-1.fna.fbcdn.net/v/t51.2885-19/s150x150/69565759_602115583653629_3895861454338785280_n.jpg?_nc_ht=instagram.fmex16-1.fna.fbcdn.net&_nc_ohc=hSKjGDBPBSsAX_09g8l&oh=2e999508260f3ac52ea388785156adb1&oe=5FB5EF0A","sole_dios",1,1
"17856763493095881","Les envíe nuevamente el MD me podrían dar respuesta gracias",1595338351,false,"1051255739",false,"https://instagram.fmex16-1.fna.fbcdn.net/v/t51.2885-19/s150x150/121440194_186636159594560_8553265859983923482_n.jpg?_nc_ht=instagram.fmex16-1.fna.fbcdn.net&_nc_ohc=eAbMb7n-7iIAX_GQ_Zp&oh=dd5d1a20e52dea9ad0c19aa4d994a496&oe=5FB2FB30","giiu.pi",1,1
"17891268307583717","Buen día, sigo esperando respuesta al reclamo que inicié hace 1 mes, POR UNA BONIFICACIÓN QUE NO APLICARON en el mes de JUNIO.
El reclamo sigue “en gestión”, alguien me puede decir en qué situación está ya que no atienden ni los teléfonos ????",1595339087,false,"962824518",false,"https://instagram.fmex16-1.fna.fbcdn.net/v/t51.2885-19/s150x150/72984639_272229920724997_2688655445724694947_n.jpg?_nc_ht=instagram.fmex16-1.fna.fbcdn.net&_nc_ohc=3xXlFtzlWO4AX9710IJ&oh=ace6260e13f485fd237f15c8f1b8dd30&oe=5FB3ACC1","julietamorin",1,7
"18076922410207937","Inoperantes atiendan por algun medio y den soluciones",1595342139,false,"4166269959",false,"https://instagram.fmex16-1.fna.fbcdn.net/v/t51.2885-19/s150x150/15034718_1778862662353845_2303049635498819584_a.jpg?_nc_ht=instagram.fmex16-1.fna.fbcdn.net&_nc_ohc=5GEZAZqzE4MAX9uusBY&oh=5eb68493f8510dc90c0e130ce551e4dc&oe=5FB456B8","edithseleme",3,1
"17919823990433592","Me ofrecieron seguir manteniendo la tarjeta de crédito del banco, sin costo alguno. 
Ahora después de casi 1 año me dicen que tengo un mantenimiento anual de $9.216 y los  tengo que pagar para darle de BAJA.
Por favor si les ofrecen una tarjeta de este Banco no la acepten te convertís en esclavo y son usureros",1595345017,false,"2881357711",false,"https://instagram.fmex16-1.fna.fbcdn.net/v/t51.2885-19/s150x150/92336573_2765609293476048_8920741623202054144_n.jpg?_nc_ht=instagram.fmex16-1.fna.fbcdn.net&_nc_ohc=fPpnkohxoV8AX96J00F&oh=3bf303032501b37bb13e4e640ccc2bc1&oe=5FB61D13","kakovale",0,0
"17855182109092746","Me ofrecieron seguir manteniendo la tarjeta de crédito del banco, sin costo alguno. 
Ahora después de casi 1 año me dicen que tengo un mantenimiento anual de $9.216 y los  tengo que pagar para darle de BAJA.
Por favor si les ofrecen una tarjeta de este Banco no la acepten te convertís en esclavo y son usureros",1595353360,false,"2881357711",false,"https://instagram.fmex16-1.fna.fbcdn.net/v/t51.2885-19/s150x150/92336573_2765609293476048_8920741623202054144_n.jpg?_nc_ht=instagram.fmex16-1.fna.fbcdn.net&_nc_ohc=fPpnkohxoV8AX96J00F&oh=3bf303032501b37bb13e4e640ccc2bc1&oe=5FB61D13","kakovale",0,0
"17860518017032007","El peor banco de Argentina. No les da vergüenza?",1595359481,false,"833768650",false,"https://instagram.fmex16-1.fna.fbcdn.net/v/t51.2885-19/s150x150/71912963_690243914790914_3397240614838861824_n.jpg?_nc_ht=instagram.fmex16-1.fna.fbcdn.net&_nc_ohc=_OILxWTeLd0AX9PlorV&oh=22927f68bf678f9b34ac7f374b9a0d6c&oe=5FB25AA1","findingjulia.27",0,0
"17873034157832423","@aprendemosjuntosbbva el número es este 9108450797002",1595522959,false,"6250186307",false,"https://instagram.fmex16-1.fna.fbcdn.net/v/t51.2885-19/s150x150/22581945_186993291861660_2440896567914266624_n.jpg?_nc_ht=instagram.fmex16-1.fna.fbcdn.net&_nc_ohc=-HmwS6cirqYAX_bfFuD&oh=a59a40edc7819579b6464a494ea41364&oe=5FB379C3","matildepalavecino",0,0
"17894786746527541","@julietamorin así es! Leen nuestros comentarios , como ven que @bbva no da respuesta ellos te mandan mensaje pidiendote teléfono y te llaman. Ellos son los culpables que les roben a sus clientes, no dan servicio. Ahora tienen que indemnizarnos doblemente!",1595554120,false,"6250186307",false,"https://instagram.fmex16-1.fna.fbcdn.net/v/t51.2885-19/s150x150/22581945_186993291861660_2440896567914266624_n.jpg?_nc_ht=instagram.fmex16-1.fna.fbcdn.net&_nc_ohc=-HmwS6cirqYAX_bfFuD&oh=a59a40edc7819579b6464a494ea41364&oe=5FB379C3","matildepalavecino",0,1
"18033398590300467","@bbva_argentina son uds los culpables! Nadie me responde los mensajes. Se pasan subiendo fotis de filosofía de plástico y los clientes sentimos q se nos rien en la casa! Iliada en la clase de literatura...acá den servicio. Creo q los ciberatacantes parten de su propia planta de personal.",1595604755,false,"6250186307",false,"https://instagram.fmex16-1.fna.fbcdn.net/v/t51.2885-19/s150x150/22581945_186993291861660_2440896567914266624_n.jpg?_nc_ht=instagram.fmex16-1.fna.fbcdn.net&_nc_ohc=-HmwS6cirqYAX_bfFuD&oh=a59a40edc7819579b6464a494ea41364&oe=5FB379C3","matildepalavecino",0,0
"17856935705077226","Estoy pensando en las lacras del BBVA y como se aprovechan de la gente en estas épocas...
Resulta que yo hace 4 meses que estoy sin trabajo por el tema pandemia, además de estar sin trabajo obviamente me quedaron deudas con el banco BBVA. El dia 23/07 el estado me depositó dos IFE, me los pagaron los dos juntos porque para el primero yo tenía mal cargados los datos. El dia 23/07 a la gente del BBVA se le ocurrió sacarme de mi cuenta uno de los dos IFE que el estado me deposito, en virtud de la deuda que yo tengo con ellos. Osea que decidieron ilegalmente y después de muchos avisos del Banco Central de que eso no se puede hacer , descontar sin siquiera previo aviso. Las denuncias ya están hechas en el Banco Central de la República Argentina, en defensa del consumidor y en el mismo banco Francés. Ellos hoy respondieron que yo tenia un producto impago por eso se tomó esa decisión.
Ese dinero que el estado deposita es para que la gente pueda comer en estos tiempos, no para pagarme mis deudas.",1595620996,false,"1953017431",false,"https://instagram.fmex16-1.fna.fbcdn.net/v/t51.2885-19/s150x150/57106756_2357747784481549_4631834096559980544_n.jpg?_nc_ht=instagram.fmex16-1.fna.fbcdn.net&_nc_ohc=RWYxYuOd-ZsAX_Q4vX0&oh=d4b3bb416c7e3f58906010f564863b6e&oe=5FB31530","eugeniogratas",1,0
"18058979836244750","Gente tengan cuidado con esta cuenta @bbva_.frances !!",1595625901,false,"355093227",false,"https://instagram.fmex16-1.fna.fbcdn.net/v/t51.2885-19/s150x150/96864542_3002115403215428_4985376498488705024_n.jpg?_nc_ht=instagram.fmex16-1.fna.fbcdn.net&_nc_ohc=ltaN3OCQXw0AX8Ln6-s&oh=086a2e88c9ec9d2e7fc613b61b7ec11f&oe=5FB2C443","estefiescu",1,0
"17854649585131157","Estoy pensando en las lacras del BBVA y como se aprovechan de la gente en estas épocas...
Resulta que yo hace 4 meses que estoy sin trabajo por el tema pandemia, además de estar sin trabajo obviamente me quedaron deudas con el banco BBVA. El dia 23/07 el estado me depositó dos IFE, me los pagaron los dos juntos porque para el primero yo tenía mal cargados los datos. El dia 23/07 a la gente del BBVA se le ocurrió sacarme de mi cuenta uno de los dos IFE que el estado me deposito, en virtud de la deuda que yo tengo con ellos. Osea que decidieron ilegalmente y después de muchos avisos del Banco Central de que eso no se puede hacer , descontar sin siquiera previo aviso. Las denuncias ya están hechas en el Banco Central de la República Argentina, en defensa del consumidor y en el mismo banco Francés. Ellos hoy respondieron que yo tenia un producto impago por eso se tomó esa decisión.
Ese dinero que el estado deposita es para que la gente pueda comer en estos tiempos, no para pagarme mis deudas.",1595852198,false,"1953017431",false,"https://instagram.fmex16-1.fna.fbcdn.net/v/t51.2885-19/s150x150/57106756_2357747784481549_4631834096559980544_n.jpg?_nc_ht=instagram.fmex16-1.fna.fbcdn.net&_nc_ohc=RWYxYuOd-ZsAX_Q4vX0&oh=d4b3bb416c7e3f58906010f564863b6e&oe=5FB31530","eugeniogratas",0,2
"17890232434602304","Necesito que me solucionen mi problema! Es urgente @bbva_argentina",1595865272,false,"1525426825",false,"https://instagram.fmex16-1.fna.fbcdn.net/v/t51.2885-19/s150x150/117592861_3270527142969696_5977246416188862830_n.jpg?_nc_ht=instagram.fmex16-1.fna.fbcdn.net&_nc_ohc=EMVVtXGEk1kAX8olBUp&oh=a073706f4df592c086b3549c959dc9d6&oe=5FB26E8A","xulheild7",0,3
"17950774279359026","Una vergüenza @bbva_argentina son el peor banco del país. Son los únicos que no atienden por teléfono. El resto de los bancos atienden sin problemas",1595949579,false,"294289785",false,"https://instagram.fmex16-1.fna.fbcdn.net/v/t51.2885-19/s150x150/72387572_2192454484387842_6268433407630376960_n.jpg?_nc_ht=instagram.fmex16-1.fna.fbcdn.net&_nc_ohc=VKUgamQRZW8AX_l0MY6&oh=66e60fb4e96732acb8689c217c742470&oe=5FB319D6","caro_moralez",0,0
"17844277016305569","Necesito que me llamen o alguien se comunique conmigo",1595949605,false,"294289785",false,"https://instagram.fmex16-1.fna.fbcdn.net/v/t51.2885-19/s150x150/72387572_2192454484387842_6268433407630376960_n.jpg?_nc_ht=instagram.fmex16-1.fna.fbcdn.net&_nc_ohc=VKUgamQRZW8AX_l0MY6&oh=66e60fb4e96732acb8689c217c742470&oe=5FB319D6","caro_moralez",0,0
"17919010066441760","Son un desastre en todos los sentidos. Llamas a cobranzas (que esos son los únicos que atienden, obvio) y te dicen una cosa y después resulta ser otra",1595949645,false,"294289785",false,"https://instagram.fmex16-1.fna.fbcdn.net/v/t51.2885-19/s150x150/72387572_2192454484387842_6268433407630376960_n.jpg?_nc_ht=instagram.fmex16-1.fna.fbcdn.net&_nc_ohc=VKUgamQRZW8AX_l0MY6&oh=66e60fb4e96732acb8689c217c742470&oe=5FB319D6","caro_moralez",0,0
"18127907209128682","Y jamás se van a equivocar a tu favor, obvio, siempre es a favor del banco",1595949681,false,"294289785",false,"https://instagram.fmex16-1.fna.fbcdn.net/v/t51.2885-19/s150x150/72387572_2192454484387842_6268433407630376960_n.jpg?_nc_ht=instagram.fmex16-1.fna.fbcdn.net&_nc_ohc=VKUgamQRZW8AX_l0MY6&oh=66e60fb4e96732acb8689c217c742470&oe=5FB319D6","caro_moralez",0,0
"17873553949838451","Sus ejecutivos prometen cosas que después no cumplen.",1595949695,false,"294289785",false,"https://instagram.fmex16-1.fna.fbcdn.net/v/t51.2885-19/s150x150/72387572_2192454484387842_6268433407630376960_n.jpg?_nc_ht=instagram.fmex16-1.fna.fbcdn.net&_nc_ohc=VKUgamQRZW8AX_l0MY6&oh=66e60fb4e96732acb8689c217c742470&oe=5FB319D6","caro_moralez",0,1
"18038068339263202","Buenas, necesito que me contacten lo antes posible. Llevo meses sin poder comunicarme",1596910722,false,"1935308181",false,"https://instagram.fmex16-1.fna.fbcdn.net/v/t51.2885-19/11352294_380546288795190_812130317_a.jpg?_nc_ht=instagram.fmex16-1.fna.fbcdn.net&_nc_ohc=ZP0bQs1rz1oAX-HPV4i&oh=aa01d1af78a64e34b006b7e7c924d6e4&oe=5FB255C8","florwodniak",0,1
"17859745748095356","Desastre que un banco como el bbva este sin atención telefónica es de terror, estsmos en África?",1597767754,false,"1933102700",false,"https://instagram.fmex16-1.fna.fbcdn.net/v/t51.2885-19/s150x150/15034693_1702820600047055_278024683452891136_a.jpg?_nc_ht=instagram.fmex16-1.fna.fbcdn.net&_nc_ohc=Cgg-Ti6fdJQAX8vsKWi&oh=8906fd8e18794e37917d63332d4de05e&oe=5FB2D941","wilson_esponja",0,4
"17867946239008394","LADRONES! HIJOS DE PUTA! LACRAS! DESDE EL 2018 QUE SOY REHÉN DE USTEDES! NO TENGO PRODUCTOS ACTIVOS, ME COBRAN MANTENIMIENTO, NO ME DAN RESPUESTA, COMO CARAJO QUIEREN QUE HAGA!??? SON LO PEOR QUE HAY!! NO ABRAN CUENTA ACÁ, ES LA PEOR DECISIÓN DE SU VIDA.",1599868264,false,"1203390749",false,"https://instagram.fmex16-1.fna.fbcdn.net/v/t51.2885-19/10665614_335957799915672_1055988752_a.jpg?_nc_ht=instagram.fmex16-1.fna.fbcdn.net&_nc_ohc=WChrm_s06hYAX8DiquE&oh=61a8028d078b4d8773b9f2fb735d7b0c&oe=5FB266CA","joacoflugel",0,0
"17846104295361676","Bando de mierda hijos de puta , ladrones de mierda !!! No se hagan de este banco son unos estafadores y están por quebrar",1600887070,false,"8066178555",false,"https://instagram.fmex16-1.fna.fbcdn.net/v/t51.2885-19/s150x150/106912304_303894834128833_6564720271441440559_n.jpg?_nc_ht=instagram.fmex16-1.fna.fbcdn.net&_nc_ohc=IsSu84THeR8AX_8m1cK&oh=36bb9f7eb4a846c043f2a86d9c7ab483&oe=5FB5B698","mariaflorencia3820",0,0